id,url,time,text,replies,retweets,likes,views,media,has_quote
1449914936402923522,https://x.com/keshinhymns/status/1449914936402923522,2021-10-18 01:47:13,"""AI isn't real"" is about coherent of a take as ""data science is fake"" 

Most people who actually have to code ML aren't under serious delusions about exactly what AI consists of—algorithms on large datasets.",3,0,31,0,,false
1449915825058562053,https://x.com/keshinhymns/status/1449915825058562053,2021-10-18 01:50:45,"Any delusional claims about AI are usually from people outside related fields. Inside the world, usually at worst you get a Godel-Escher-Bach-ian concerning what can and cannot emerge from algorithms. Which is a fairly legitimate discussion.",3,0,15,0,,false
1449955371418673152,https://x.com/keshinhymns/status/1449955371418673152,2021-10-18 04:27:54,I gots glasses,1,0,1,0,,false
1449964268527390723,https://x.com/keshinhymns/status/1449964268527390723,2021-10-18 05:03:15,I’ve definitely had the same thoughts. My visions awful but I’ve been reliant on glasses since elementary school,0,0,0,0,,false
1449982401258549249,https://x.com/keshinhymns/status/1449982401258549249,2021-10-18 06:15:18,deep diving the abolition of Prussia so I can do this on my next tinder date,0,0,1,0,,true
1450194519173910528,https://x.com/keshinhymns/status/1450194519173910528,2021-10-18 20:18:11,Surpass this. Strive to be happily represented both by your inner life and yourself entirely superficially.,0,0,0,0,,true
