id,url,time,text,replies,retweets,likes,views,media,has_quote
1561881453880803329,https://x.com/keshinhymns/status/1561881453880803329,2022-08-23 01:02:11,"<a href=""/credenzaclear2"" title=""Audrey Horne Online"">@credenzaclear2</a>",0,0,0,0,https://pbs.twimg.com/media/Fazq5zzUUAAZmKh.jpg,false
1561903376320712704,https://x.com/keshinhymns/status/1561903376320712704,2022-08-23 02:29:18,"stalking irl ppl I know with my racist anon account, carefully not liking any of their rts., I play a dangerous sport",0,0,2,0,,false
1561903632890490882,https://x.com/keshinhymns/status/1561903632890490882,2022-08-23 02:30:19,"can one of u nerds tell me if I should get the 14 inch or the 16 inch macbook, or if I should wait for the next one",5,0,29,0,,false
1561907393474179072,https://x.com/keshinhymns/status/1561907393474179072,2022-08-23 02:45:16,people say this but pull all nighters debugging their pr in bed,1,0,5,0,,false
1561911566580142080,https://x.com/keshinhymns/status/1561911566580142080,2022-08-23 03:01:51,never wouldvre guessed you were a 0hp alt,1,0,3,0,,false
1561912324356681728,https://x.com/keshinhymns/status/1561912324356681728,2022-08-23 03:04:51,gnosticism (n) study of gnocchi,0,0,2,0,,false
1561914337312542720,https://x.com/keshinhymns/status/1561914337312542720,2022-08-23 03:12:51,work provided a 16 inch m1 over summer and it is now taken away.. this is surely what the buddha meant by impermanence of all things,0,0,8,0,,false
1561921527179649024,https://x.com/keshinhymns/status/1561921527179649024,2022-08-23 03:41:25,"whites deride ""uncivilized"" cultures for thinking the gods want blood sacrifices. You literally eat meat?!",0,0,2,0,,false
1561922198914285574,https://x.com/keshinhymns/status/1561922198914285574,2022-08-23 03:44:05,"literally in bed rn on my ngmi macbook (15 inch, 2019, touchbar, cringe keyboard) doing big work (scrolling)",0,0,2,0,,false
