id,url,time,text,replies,retweets,likes,views,media,has_quote
1484749267184992257,https://x.com/keshinhymns/status/1484749267184992257,2022-01-22 04:46:25,"relative at Stanford:
“two of my friends have dropped out already [to found startups]”

she’s a freshman",0,0,0,0,,false
1484750515586039810,https://x.com/keshinhymns/status/1484750515586039810,2022-01-22 04:51:22,perhaps I should strive to surround myself with people with great taste,0,0,0,0,,false
1484810523250102273,https://x.com/keshinhymns/status/1484810523250102273,2022-01-22 08:49:49,I think math is a creative subject but it’s kinda shady no mathematician smokes weed when writing proofs,0,0,0,0,,false
1484811550791651329,https://x.com/keshinhymns/status/1484811550791651329,2022-01-22 08:53:54,I’m like the Archimedes of tweeting,0,0,0,0,,false
1484812076778360834,https://x.com/keshinhymns/status/1484812076778360834,2022-01-22 08:56:00,Nah it’s about us tech ppl being completely fine &amp; well earning thru covid,0,0,0,0,,false
1484812664224116737,https://x.com/keshinhymns/status/1484812664224116737,2022-01-22 08:58:20,why are roon and Rahul history-educated. Not very tech bro of them,0,0,2,0,,true
1484939076499230720,https://x.com/keshinhymns/status/1484939076499230720,2022-01-22 17:20:39,What’s a lindy way of hitting chest? Push-ups?,0,0,0,0,,false
