id,url,time,text,replies,retweets,likes,views,media,has_quote
1168588251659218947,https://x.com/LandsharkRides/status/1168588251659218947,2019-09-02 18:15:25,"day tanning for hours in the nude. Special meteorological rockets laying waste to every cloud to block the healing rays. Every night, after dark, people watch live footage of the Sunrise in lands far away and take comfort that the Sun shines on for another day. Life is bright.",0,1,18,0,,false
1168588378167808002,https://x.com/LandsharkRides/status/1168588378167808002,2019-09-02 18:15:55,Same as Christ feeding the multitudes with the fish,1,0,0,0,,false
1168590483196710914,https://x.com/LandsharkRides/status/1168590483196710914,2019-09-02 18:24:17,"Attila the Hun was a Christian, who was converted by Saint Lupus of Troyes, but yáll are not ready for this conversation (yet)",5,1,24,0,,false
1168591351627341824,https://x.com/LandsharkRides/status/1168591351627341824,2019-09-02 18:27:44,"Honestly, I feel the same way.",1,0,16,0,https://pbs.twimg.com/media/EDero75WsAAwYWV.png,false
1168592573310672902,https://x.com/LandsharkRides/status/1168592573310672902,2019-09-02 18:32:35,Hello @memento_melissa my friends Linkola are good America boy perform heavy squat exercise acrobatic pose bathroom - are perfect opportunity blessing strong son blond hairs.,0,0,6,0,,false
1168592867616591872,https://x.com/LandsharkRides/status/1168592867616591872,2019-09-02 18:33:45,Counter-Strike 1.6,1,0,9,0,,true
1168595609596694528,https://x.com/LandsharkRides/status/1168595609596694528,2019-09-02 18:44:39,"This is a true story as far as I know. The man basically got paid to sleep with as many women as possible and make bastard children. This is not a good moral story, but, dang it, this might come very close to the greatest ""dream job"" that has ever existed",4,0,15,0,,false
1168595608355184641,https://x.com/LandsharkRides/status/1168595608355184641,2019-09-02 18:44:39,"I know a story from Soviet times of a communist mayor who invited a man to his city and gave him a very good-paying job, because he ""had very good genetics"" and the mayor wanted him to seduce as many women as possible and impregnate them - to spread his good genes.",3,0,17,0,,false
1168595652206649345,https://x.com/LandsharkRides/status/1168595652206649345,2019-09-02 18:44:49,nah lol,0,0,0,0,,false
1168597165385670656,https://x.com/LandsharkRides/status/1168597165385670656,2019-09-02 18:50:50,,0,1,19,0,https://pbs.twimg.com/media/EDew6jiXUAEzwv0.jpg;https://pbs.twimg.com/media/EDew6jhX4AA2qMN.jpg,false
1168601874498576384,https://x.com/LandsharkRides/status/1168601874498576384,2019-09-02 19:09:33,No more brother wars 🇧🇬🇹🇷,0,0,8,0,,false
1168603356144766977,https://x.com/LandsharkRides/status/1168603356144766977,2019-09-02 19:15:26,"- Associate them with the comedical in the public's collective consciousness

- Prevent search engines from finding true MIB experience information

Right, anon?",1,0,16,0,,false
1168603354857136130,https://x.com/LandsharkRides/status/1168603354857136130,2019-09-02 19:15:26,"All of you are already redpilled on the ""Men in Black"" movie being produced to:

- Portray MIB as normal-looking men instead of demonic humanoids with weird corporal structure and unusual height

- Show them working for a governmental agency, instead of following ulterior motives",5,1,26,0,,false
1168604053506527233,https://x.com/LandsharkRides/status/1168604053506527233,2019-09-02 19:18:12,🤔🤔,0,0,0,0,,false
1168605109741346822,https://x.com/LandsharkRides/status/1168605109741346822,2019-09-02 19:22:24,Hahahahhhahaaha How The Hell Are Demonic Experiences Real Hahahaha Bro Just Pronounce Jesus Christ's Name Like Bro You're Under Divine Protection Haha,2,4,67,0,,false
1168606195369877504,https://x.com/LandsharkRides/status/1168606195369877504,2019-09-02 19:26:43,Spell His name with a capital letter for a start,1,0,5,0,,false
1168607206532685826,https://x.com/LandsharkRides/status/1168607206532685826,2019-09-02 19:30:44,"Just saying the name is enough, like ""Jesus Christ please help me"". You should also ask St. Michael for protection.",1,1,6,0,,false
1168608334481674240,https://x.com/LandsharkRides/status/1168608334481674240,2019-09-02 19:35:13,"Christianity is the ship, but it is also the waters

t. Chesterton",0,0,1,0,,false
1168609533016576000,https://x.com/LandsharkRides/status/1168609533016576000,2019-09-02 19:39:59,"As a joke or a light insult no, if used in a scientific manner (used to imply some races are not human) then it is highly demonic",0,0,1,0,,false
1168610972422066177,https://x.com/LandsharkRides/status/1168610972422066177,2019-09-02 19:45:42,Best tweets never get over 10 likes etc. etc.,1,0,2,0,,false
1168611071571177472,https://x.com/LandsharkRides/status/1168611071571177472,2019-09-02 19:46:05,Both I think,0,0,0,0,,false
1168611868400918528,https://x.com/LandsharkRides/status/1168611868400918528,2019-09-02 19:49:15,"<a href=""/LandsharkRides"" title=""Landshark"">@LandsharkRides</a> is for the children",0,0,1,0,,false
1168612274229174273,https://x.com/LandsharkRides/status/1168612274229174273,2019-09-02 19:50:52,"Favstar is dead, isn't it?",0,0,0,0,,false
1168612877542010880,https://x.com/LandsharkRides/status/1168612877542010880,2019-09-02 19:53:16,,3,0,14,0,https://pbs.twimg.com/media/EDe_NyHXUAAg0ad.png;https://pbs.twimg.com/media/EDe_NyGXUAAw0O4.png,false
1168613285383589889,https://x.com/LandsharkRides/status/1168613285383589889,2019-09-02 19:54:53,"And yeah, the comic is a good example of people misunderstanding what evolution consists of",0,0,9,0,,false
1168614280608067584,https://x.com/LandsharkRides/status/1168614280608067584,2019-09-02 19:58:50,I have triple the amount of followers and I still am a William Guppy reply guy,0,0,1,0,,false
1168615123105267713,https://x.com/LandsharkRides/status/1168615123105267713,2019-09-02 20:02:11,"Dunking on animals to own the atheists never sits right with me tbh, God's glory is reflected in all of Creation",2,0,4,0,,false
1168615516510007296,https://x.com/LandsharkRides/status/1168615516510007296,2019-09-02 20:03:45,"Once a reply guy, always a reply guy",0,0,0,0,,false
1168615753916067840,https://x.com/LandsharkRides/status/1168615753916067840,2019-09-02 20:04:42,"Why did you have me blocked, why did you unblock me, and why do you not follow back",0,0,2,0,,false
1168616426338430976,https://x.com/LandsharkRides/status/1168616426338430976,2019-09-02 20:07:22,Based,1,0,1,0,,false
1168617063725916161,https://x.com/LandsharkRides/status/1168617063725916161,2019-09-02 20:09:54,Can't wait to get hard seltzer in Bulgaria and join the fun,0,0,1,0,,false
1168619019282321411,https://x.com/LandsharkRides/status/1168619019282321411,2019-09-02 20:17:40,"No idea tbh but I like Jack Chick, he was pretty redpilled on some stuff even tho he was turboprot",0,0,1,0,,false
1168619748881575938,https://x.com/LandsharkRides/status/1168619748881575938,2019-09-02 20:20:34,,0,0,1,0,https://pbs.twimg.com/media/EDfFdwXXYAECNam.png;https://pbs.twimg.com/media/EDfFdwdX4AIoE0q.png,false
1168620282199904256,https://x.com/LandsharkRides/status/1168620282199904256,2019-09-02 20:22:41,🤫🤫,0,3,30,0,https://pbs.twimg.com/media/EDfF81iX4AAu19O.png;https://pbs.twimg.com/media/EDfF81pXkAUrGqu.png,false
1168620781645049856,https://x.com/LandsharkRides/status/1168620781645049856,2019-09-02 20:24:40,"These are all very solid takes, I love you, brother. Except the Shakespearean characters being bad.",0,0,1,0,,false
1168621485524692992,https://x.com/LandsharkRides/status/1168621485524692992,2019-09-02 20:27:28,,1,1,4,0,https://pbs.twimg.com/media/EDfHC3kWkAIz4Rb.png,false
1168623667351363584,https://x.com/LandsharkRides/status/1168623667351363584,2019-09-02 20:36:08,"Remembered that there was a known pedophile hanging out around my highschool... damn, I should have minecrafted him back then",0,0,4,0,,false
1168623779754446855,https://x.com/LandsharkRides/status/1168623779754446855,2019-09-02 20:36:35,"I mean, walking nude is not sinful in itself",1,0,1,0,,false
1168624801059102721,https://x.com/LandsharkRides/status/1168624801059102721,2019-09-02 20:40:39,Not necessarily,0,0,1,0,,false
1168625675202416641,https://x.com/LandsharkRides/status/1168625675202416641,2019-09-02 20:44:07,"Cringe is just the secular version of sin: just as men used to fall asleep thinking about how they wronged the Lord, so do they now remember a time they made fools of themselves.

Cringe is confessed and absolved by the therapist, cringe is what you are remembered by after death.",3,9,58,0,,false
1168625749819043841,https://x.com/LandsharkRides/status/1168625749819043841,2019-09-02 20:44:25,,2,0,2,0,,true
1168625913346646017,https://x.com/LandsharkRides/status/1168625913346646017,2019-09-02 20:45:04,The only test for me that I am growing as a person is if I find my tweets from 3 months ago cringe,0,0,1,0,,false
1168627119129321472,https://x.com/LandsharkRides/status/1168627119129321472,2019-09-02 20:49:51,"Turtles see reddit as jellyfish, attempt to eat it, and choke on it. There is also often found reddit in the stomachs of whales. In the oceans, there are already reddit islands. Rivers of reddit flow through India and bring reddit to the seas. There is microreddit in your blood.",1,1,16,0,,false
1168627472558166016,https://x.com/LandsharkRides/status/1168627472558166016,2019-09-02 20:51:16,"Your food comes packaged in reddit. Your baby's toys are made out of reddit. Reddit does not rot, but stays in the soil, poisoning it. Skin contact with reddit is proven to lower testosterone levels in men and causes infertility in women. Our age shall be known as the reddit age.",0,1,17,0,,false
1168631337475031043,https://x.com/LandsharkRides/status/1168631337475031043,2019-09-02 21:06:37,"No, it was a thought that has been in my mind recently, and your tweet reminded me of it. So, reverse synchronicity from your perspective",0,0,1,0,,false
1168632372901924873,https://x.com/LandsharkRides/status/1168632372901924873,2019-09-02 21:10:44,"I've actually studied in a Catholic school as a child, so I know my Christianity - and I can't help but laugh at your bigoted comment, sir. Did you not know that, when on earth, Christ spent time with prostitutes and the homeless? Have you ever actually read your Bible, sir? Plea",0,1,28,0,,false
1168636474721472518,https://x.com/LandsharkRides/status/1168636474721472518,2019-09-02 21:27:02,What is their bodyfat %  ??,14,9,80,0,https://pbs.twimg.com/media/EDfUrFZX4AA6eir.jpg;https://pbs.twimg.com/media/EDfUrFaXoAEgNfL.jpg,false
1168637085353488385,https://x.com/LandsharkRides/status/1168637085353488385,2019-09-02 21:29:28,Warning: Do NOT under any circumstances drink poison willingly. The experience is in reality one of excruciating pain and pure horror.,1,0,8,0,https://pbs.twimg.com/media/EDfVO_OXsAAlkY4.png,false
1168637802201931783,https://x.com/LandsharkRides/status/1168637802201931783,2019-09-02 21:32:18,"Being a right-wing communist is, very possibly, the highest testosterone ideology in existence right now. I am pretty sure most leftists hate turbo-tankies far more than they actually dislike right-wingers.",3,1,27,0,,false
1168638611786518529,https://x.com/LandsharkRides/status/1168638611786518529,2019-09-02 21:35:31,Thought of it in shower.,0,0,1,0,,false
1168639817191763969,https://x.com/LandsharkRides/status/1168639817191763969,2019-09-02 21:40:19,"An old, 26 year old child",0,0,2,0,,false
1168640297372463105,https://x.com/LandsharkRides/status/1168640297372463105,2019-09-02 21:42:13,Acts of Pilate,1,0,0,0,,false
1168641666837811204,https://x.com/LandsharkRides/status/1168641666837811204,2019-09-02 21:47:40,"People think they are ""perverts"" or ""libertines"" for having sexual attraction to heteronormative things like pieces of clothing, lip colours, chains - I myself am proud to say that I am able to fetishize internal bodily processes, breathing techniques, architectural movements...",9,7,74,0,,false
1168643175201824774,https://x.com/LandsharkRides/status/1168643175201824774,2019-09-02 21:53:39,"Pre-Raphaelitism is inherently sexual, Rococo is fetishistic. Anterior pelvic tilt makes for a feminine posture. Rainstorms and thunder are nature-wide orgasms. Mint tea is womanly. The act of writing writing with a pen is disgustingly sexual, no matter who performs it or how.",1,0,34,0,,false
1168643634297745409,https://x.com/LandsharkRides/status/1168643634297745409,2019-09-02 21:55:29,"Is Landshark joking again - or is this tweet indeed serious? Boy, oh boy! I can guarantee, all I say on religion and health is fully sincere, those are no subjects to joke about. Other than that though, everything is a wildcard!",0,0,9,0,,false
1168645744372408321,https://x.com/LandsharkRides/status/1168645744372408321,2019-09-02 22:03:52,"Any man, who is under 17, and is not a Theocratic Anarcho-National-Bolshevik has no heart;

And any man, who is over 17, and does not laugh at idiots who give a crap about this shit, has no brains.

- Michael Obama",1,3,35,0,,false
1168645816233463808,https://x.com/LandsharkRides/status/1168645816233463808,2019-09-02 22:04:09,dunno both pics copped from /fit/,0,0,0,0,,false
1168646159893708801,https://x.com/LandsharkRides/status/1168646159893708801,2019-09-02 22:05:31,"It's time to grow up and realize that anything except ""left-wing"" or ""right-wing"" has no real meaning.",1,0,7,0,,false
1168646369910972416,https://x.com/LandsharkRides/status/1168646369910972416,2019-09-02 22:06:21,Some of you have never drifted with a car and it SHOWS,1,0,5,0,,false
1168647583788687361,https://x.com/LandsharkRides/status/1168647583788687361,2019-09-02 22:11:11,"ANTI-BABYLONIAN DISCRIMINATION
ANTI-BABYLONIAN DISCRIMINATION 
ANTI-BABYLONIAN DISCRIMINATION",0,1,8,0,,true
