id,url,time,text,replies,retweets,likes,views,media,has_quote
1098478201188306944,https://x.com/LandsharkRides/status/1098478201188306944,2019-02-21 07:03:06,"God willing, we will!",0,0,0,0,,false
1098480241054531584,https://x.com/LandsharkRides/status/1098480241054531584,2019-02-21 07:11:12,"&gt;he doesn't know what jawmaxxing is
LMAO",1,0,1,0,,false
1098481762798309378,https://x.com/LandsharkRides/status/1098481762798309378,2019-02-21 07:17:15,Inshallah,0,0,0,0,,false
1098484609292136448,https://x.com/LandsharkRides/status/1098484609292136448,2019-02-21 07:28:34,DYEL lol,0,0,0,0,,false
1098496751567278080,https://x.com/LandsharkRides/status/1098496751567278080,2019-02-21 08:16:49,"Take notes, fellas, this is how it's done",0,0,0,0,,true
1098496949945286656,https://x.com/LandsharkRides/status/1098496949945286656,2019-02-21 08:17:36,"Isn't it blasphemous to call it garbage tho, it's still the Bible",1,0,0,0,,false
1098500406886449152,https://x.com/LandsharkRides/status/1098500406886449152,2019-02-21 08:31:20,Stretch and move around a bit,0,0,0,0,,false
1098501210598981632,https://x.com/LandsharkRides/status/1098501210598981632,2019-02-21 08:34:32,"You slept on them in bad position, stretch for 2 mins and go back",0,0,0,0,,false
1098501690544869376,https://x.com/LandsharkRides/status/1098501690544869376,2019-02-21 08:36:26,Do you know how to do it properly tho? If not u can fuggg urself up,0,0,0,0,,false
1098502399050821632,https://x.com/LandsharkRides/status/1098502399050821632,2019-02-21 08:39:15,"Will DM u later, busy now",0,0,0,0,,false
1098508794282344448,https://x.com/LandsharkRides/status/1098508794282344448,2019-02-21 09:04:40,"Handegg, howndo you progress on OHP? I like to do push press/cheat after I run out of power to do regular reps",1,0,0,0,,false
1098528130380247040,https://x.com/LandsharkRides/status/1098528130380247040,2019-02-21 10:21:30,Didn't we all?,1,0,1,0,,false
1098528219807039490,https://x.com/LandsharkRides/status/1098528219807039490,2019-02-21 10:21:51,Lmao politics go back to 2016 bro lol,0,0,0,0,,false
1098559510019477504,https://x.com/LandsharkRides/status/1098559510019477504,2019-02-21 12:26:12,Uh oh,0,0,1,0,,false
1098560735582568448,https://x.com/LandsharkRides/status/1098560735582568448,2019-02-21 12:31:04,"Want to have a good day/evening?

- Call your grandma/grandpa
- Message an old friend who you no longer really talk to ""what up bro""
- Drink a cup of tea
- Say a quick prayer
- Do a small 20 min workout
- Read a very short story (why not Borges?)

Love ya, fellas, stay joyful!",0,3,20,0,https://pbs.twimg.com/media/Dz7fKlbWsAAr0zT.jpg,false
1098562947662708736,https://x.com/LandsharkRides/status/1098562947662708736,2019-02-21 12:39:51,NOT allow,0,0,1,0,,false
1098565078213898240,https://x.com/LandsharkRides/status/1098565078213898240,2019-02-21 12:48:19,"wtf <a href=""/liangweihan4"" title=""Weihan Zhang"">@liangweihan4</a> can he do this?!",1,0,1,0,,false
1098568068291121152,https://x.com/LandsharkRides/status/1098568068291121152,2019-02-21 13:00:12,It wasn't real but it can become,0,0,0,0,,false
1098602401882357760,https://x.com/LandsharkRides/status/1098602401882357760,2019-02-21 15:16:38,"BAP is a footf*g, what has this world come to...",1,0,5,0,,false
1098602802375462913,https://x.com/LandsharkRides/status/1098602802375462913,2019-02-21 15:18:13,"Very beautiful physique, dude, especially the shoulders, gj bro",0,0,2,0,,false
1098605979950899201,https://x.com/LandsharkRides/status/1098605979950899201,2019-02-21 15:30:51,Train. Neck.,1,2,13,0,,true
1098606715996725249,https://x.com/LandsharkRides/status/1098606715996725249,2019-02-21 15:33:46,Phe what breed is he? He vry cute,1,0,0,0,,false
1098609199762866177,https://x.com/LandsharkRides/status/1098609199762866177,2019-02-21 15:43:39,"Is this true? <a href=""/HakonRotmwrt"" title=""Hakan Rotmwrt"">@HakonRotmwrt</a>",0,0,1,0,https://pbs.twimg.com/media/Dz8LPJcWkAAO-yY.jpg,false
1098610291527598080,https://x.com/LandsharkRides/status/1098610291527598080,2019-02-21 15:47:59,Accelerationist Trump is the timeline I didn't know I needed,0,0,0,0,,false
1098627256761618438,https://x.com/LandsharkRides/status/1098627256761618438,2019-02-21 16:55:24,Wtf shut up u home of sexual,0,0,0,0,,false
1098628102245281792,https://x.com/LandsharkRides/status/1098628102245281792,2019-02-21 16:58:45,"It will be pathetic though, changing the body without changin the soul will result in a bunch of spiritual eunuchs wearing the bodies greek demigods... High IQ doesnt matter if you dont use properly, chiseled physique useless in an impotent man",0,0,2,0,,false
1098633617205575681,https://x.com/LandsharkRides/status/1098633617205575681,2019-02-21 17:20:40,Wtf its altright cant u read lol,0,0,2,0,,false
1098641261173661698,https://x.com/LandsharkRides/status/1098641261173661698,2019-02-21 17:51:03,"&gt;cigani refusing beer/money

Something's deeply wrong with this story...",1,0,7,0,,false
1098642676503724033,https://x.com/LandsharkRides/status/1098642676503724033,2019-02-21 17:56:40,&gt;having nightmares,0,0,1,0,,false
1098647149984825344,https://x.com/LandsharkRides/status/1098647149984825344,2019-02-21 18:14:27,"I dreamt of a gym, where powerlifters compete in heavy weighted cardio, in which people do cable deadlifts and overhead presses, where instead of a water fountain there is one with whole milk and cherry juice, where barbells are heavy and weights float upwards.. Wat mean",2,3,19,0,,false
1098647544664600577,https://x.com/LandsharkRides/status/1098647544664600577,2019-02-21 18:16:01,"BAD take, God intended fish for BBQ when he created it",1,0,3,0,,false
1098647956130009089,https://x.com/LandsharkRides/status/1098647956130009089,2019-02-21 18:17:39,I am SLAV,0,0,7,0,,false
1098654879004925953,https://x.com/LandsharkRides/status/1098654879004925953,2019-02-21 18:45:09,Writing a book on bodybuilding theology.,3,1,6,0,,false
1098655391133638656,https://x.com/LandsharkRides/status/1098655391133638656,2019-02-21 18:47:11,"This <a href=""/nastyinmuhtaxi"" title=""Ulysses"">@nastyinmuhtaxi</a>-approved?",1,0,1,0,,false
1098655838900752384,https://x.com/LandsharkRides/status/1098655838900752384,2019-02-21 18:48:58,People who piss in a toilet when there are urinals available are the weakest race,4,2,4,0,,false
1098656873492955141,https://x.com/LandsharkRides/status/1098656873492955141,2019-02-21 18:53:05,Lmao this a bit similar to my phone case,0,0,0,0,,false
1098657325106282496,https://x.com/LandsharkRides/status/1098657325106282496,2019-02-21 18:54:53,"In future humanity is split into two genetically different species: ""poasters"" and ""followers""",1,3,3,0,,false
1098658445266436104,https://x.com/LandsharkRides/status/1098658445266436104,2019-02-21 18:59:20,"Please go for all of them, but if you have to choose one, number 2 is best",0,0,1,0,,false
1098661710200795136,https://x.com/LandsharkRides/status/1098661710200795136,2019-02-21 19:12:18,"&gt;Let's go out in like an hour

Hour and a half pass

&gt;I'll be ready in a bit

Half an hour passes

&gt;5 minutes and I'll be downstairs

Said 20 minutes ago.

Girls. How do they work? No one knows.",1,0,0,0,,false
1098688890729361408,https://x.com/LandsharkRides/status/1098688890729361408,2019-02-21 21:00:18,"Thanks for suggestion, will do!",0,0,0,0,,false
1098689021138620416,https://x.com/LandsharkRides/status/1098689021138620416,2019-02-21 21:00:49,"When I make a homegym that's what im calling it too, Inshallah",0,0,0,0,,false
1098689608798429186,https://x.com/LandsharkRides/status/1098689608798429186,2019-02-21 21:03:10,"Better not risk it, bro",0,0,0,0,,false
1098697309959999488,https://x.com/LandsharkRides/status/1098697309959999488,2019-02-21 21:33:46,This shit made me laugh irl lmao,0,0,1,0,,false
1098698266735247363,https://x.com/LandsharkRides/status/1098698266735247363,2019-02-21 21:37:34,People who piss in a toilet and don't purposefuly aim for the middle of the bowl as to make as much noise as possible are even worse,0,0,0,0,,false
1098698735264194564,https://x.com/LandsharkRides/status/1098698735264194564,2019-02-21 21:39:25,"I definitely can't reconcile Christianity with extraterrestial life, will love to hear someone who disagrees though",3,0,2,0,,false
1098699166619000833,https://x.com/LandsharkRides/status/1098699166619000833,2019-02-21 21:41:08,Not like my boy Big M,0,0,0,0,https://pbs.twimg.com/media/Dz9dD_OXcAAhmmL.jpg,false
1098699526662209536,https://x.com/LandsharkRides/status/1098699526662209536,2019-02-21 21:42:34,"I guess you are right, friend.",0,0,0,0,,false
1098703230761160704,https://x.com/LandsharkRides/status/1098703230761160704,2019-02-21 21:57:17,"Other topics inside include:

Spider theology
Time theology
Prole laymen folk theology
Nervous system typology
Musculature typogeography
Biocryptology
Hypnotheology
Longwordmakeology

Ok maybe without the last one",1,0,2,0,,false
1098703559296778241,https://x.com/LandsharkRides/status/1098703559296778241,2019-02-21 21:58:36,Piss on floor,0,0,0,0,,false
1098703634089590784,https://x.com/LandsharkRides/status/1098703634089590784,2019-02-21 21:58:53,Queen...,0,0,0,0,,false
1098705130021703681,https://x.com/LandsharkRides/status/1098705130021703681,2019-02-21 22:04:50,Spiders protected Christ and Mary. Here they considered holy creatures. I love them a lot,0,0,0,0,,false
1098708468784091136,https://x.com/LandsharkRides/status/1098708468784091136,2019-02-21 22:18:06,Unironically based,0,0,0,0,,false
1098712032780738561,https://x.com/LandsharkRides/status/1098712032780738561,2019-02-21 22:32:16,"Just a reminder buzzcut is the best haircut, fellas",3,0,1,0,,false
1098712343587049472,https://x.com/LandsharkRides/status/1098712343587049472,2019-02-21 22:33:30,"Fact check: true

Crew cut is good too though",2,0,1,0,,false
1098716521910677504,https://x.com/LandsharkRides/status/1098716521910677504,2019-02-21 22:50:06,My slavic genetics guarantee that I will keep my vigorous hair for many long years,0,0,0,0,,false
1098717362147258370,https://x.com/LandsharkRides/status/1098717362147258370,2019-02-21 22:53:26,"The sea is most beautiful in winter, few know this",0,0,1,0,,false
1098717800099704832,https://x.com/LandsharkRides/status/1098717800099704832,2019-02-21 22:55:11,I see the anti-logo coalition is successfully being formed,0,0,1,0,,false
