id,url,time,text,replies,retweets,likes,views,media,has_quote
1301798050894090240,https://x.com/LandsharkRides/status/1301798050894090240,2020-09-04 08:23:36,I like them,0,0,1,0,,false
1301798690366066691,https://x.com/LandsharkRides/status/1301798690366066691,2020-09-04 08:26:08,gm,0,0,2,0,,false
1301799120957566977,https://x.com/LandsharkRides/status/1301799120957566977,2020-09-04 08:27:51,"Cant, you kno we love tha rama rama",0,0,11,0,,false
1301805468818513925,https://x.com/LandsharkRides/status/1301805468818513925,2020-09-04 08:53:04,both.,0,0,1,0,,false
1301806762862010369,https://x.com/LandsharkRides/status/1301806762862010369,2020-09-04 08:58:13,"If you come from a people who traditionally practiced archery, but do not perform horizontal shotgun rows in the gym..... let's just say you won't be making it soon....",3,1,35,0,,false
1301814957760274432,https://x.com/LandsharkRides/status/1301814957760274432,2020-09-04 09:30:47,"This is true, war and chess have been equated for a long time.

Every time I outmaneuver the enemy jungler and kill him at his blue, in my mind eye I see my great grandfather's grandfather ambushing his great grandfather's grandfather in a forest and breaking his cranium in.",3,0,47,0,,true
1301829304943357953,https://x.com/LandsharkRides/status/1301829304943357953,2020-09-04 10:27:47,The reverse black hebrew,3,0,23,0,,true
1301837125504192517,https://x.com/LandsharkRides/status/1301837125504192517,2020-09-04 10:58:52,"Just ""mount""",0,0,9,0,,false
1301839402423984130,https://x.com/LandsharkRides/status/1301839402423984130,2020-09-04 11:07:55,Is carbon dating bullshit or legit?,14,0,31,0,,false
1301854036841443328,https://x.com/LandsharkRides/status/1301854036841443328,2020-09-04 12:06:04,Dr. Rayp Eat already debunked this one,1,0,4,0,,false
1301855605691424768,https://x.com/LandsharkRides/status/1301855605691424768,2020-09-04 12:12:18,,6,0,66,0,https://pbs.twimg.com/media/EhEexO1XcAEMy-T.png,false
1301859189036404736,https://x.com/LandsharkRides/status/1301859189036404736,2020-09-04 12:26:32,"""In this building, it is a custom to save time for siesta.""",0,0,5,0,,false
1301862841440448513,https://x.com/LandsharkRides/status/1301862841440448513,2020-09-04 12:41:03,,3,0,69,0,https://pbs.twimg.com/media/EhElV3nXYAAOsBd.png,false
1301865402633457664,https://x.com/LandsharkRides/status/1301865402633457664,2020-09-04 12:51:14,too long to explain if u dont get it immediately,0,0,4,0,,false
1301865822617513985,https://x.com/LandsharkRides/status/1301865822617513985,2020-09-04 12:52:54,Two old mashups of mine,1,0,25,0,https://pbs.twimg.com/media/EhEn-QeX0AE1wXR.jpg,false
1301865833988325378,https://x.com/LandsharkRides/status/1301865833988325378,2020-09-04 12:52:56,,0,0,14,0,https://pbs.twimg.com/media/EhEoEuTWAAE_Gss.jpg,false
1301868585455939584,https://x.com/LandsharkRides/status/1301868585455939584,2020-09-04 13:03:52,👁️👁️👁️,0,0,3,0,,false
1301874264589598726,https://x.com/LandsharkRides/status/1301874264589598726,2020-09-04 13:26:26,hmmmmmm,1,0,2,0,,false
1301885863991955456,https://x.com/LandsharkRides/status/1301885863991955456,2020-09-04 14:12:32,"all pre-Biblical texts are just degenerated Biblical texts, post-Biblical if we are to name them, there is nothing older than Genesis",1,0,1,0,,false
1301886771513511936,https://x.com/LandsharkRides/status/1301886771513511936,2020-09-04 14:16:08,"""A target can be *created* through the act of pointing""",0,0,20,0,,false
1301887446028816385,https://x.com/LandsharkRides/status/1301887446028816385,2020-09-04 14:18:49,"the one we have is the original (albeit we read it in translation), the phoenician version is more or less a ""chinese whisper"" of it",0,0,1,0,,false
1301887752456359938,https://x.com/LandsharkRides/status/1301887752456359938,2020-09-04 14:20:02,,1,0,9,0,https://pbs.twimg.com/media/EhE8AaGXYAAnu21.jpg,false
1301902391743320064,https://x.com/LandsharkRides/status/1301902391743320064,2020-09-04 15:18:13,"All flows through the laws of nature. We labour in our paths, all of them predetermined, and eventually all lost will be restored, every specific thing by a specific someone. Kali Yuga is doomed to end.",0,0,10,0,,false
1301902845365678083,https://x.com/LandsharkRides/status/1301902845365678083,2020-09-04 15:20:01,"Pigeon update: Been rummaging around the balcony all day, trying to fly out of the window. It has chosen, I think, it wants freedom, I was ready to nurse it forever if I had to, but it really wants to fly away. But just before winter? Seems like certain death to me, need to think",5,0,38,0,,false
1301903006926024704,https://x.com/LandsharkRides/status/1301903006926024704,2020-09-04 15:20:39,"Quite sublime that it's called ""a flight of stairs"", climbing stairs is human equivalent to flying",1,0,35,0,,false
1301903176933740545,https://x.com/LandsharkRides/status/1301903176933740545,2020-09-04 15:21:20,worst timeline,1,0,0,0,,false
1301905623832031232,https://x.com/LandsharkRides/status/1301905623832031232,2020-09-04 15:31:03,"I welcome your suggestions. Cage it and give to grandma, or let it try to survive in the wild? If latter: I am going to leave the window open so it can return any time it wants. Also I've heard their lungs get fucked if they don't fly enough, so I think cage will slowly kill it.",7,0,16,0,,false
1301907622237540353,https://x.com/LandsharkRides/status/1301907622237540353,2020-09-04 15:39:00,"interesting, how big is a pigeon family? like its siblings and partner, mother and father? I know basically nothing about their social structures. do they share a nest, a nest group?",0,0,0,0,,false
1301907695675617282,https://x.com/LandsharkRides/status/1301907695675617282,2020-09-04 15:39:17,wat mean,0,0,1,0,,false
1301907933647843329,https://x.com/LandsharkRides/status/1301907933647843329,2020-09-04 15:40:14,lmfaoo,0,0,1,0,,false
1301909758279122945,https://x.com/LandsharkRides/status/1301909758279122945,2020-09-04 15:47:29,"People often ask this one specific thing on /fit/: How do I get strong enough to be able to pick up a girl and carry her around, like a bride or for lewd purposes? The answer is simple, Zercher Squats. Get to two plates (takes 2 weeks) and you'll be able to carry any woman easily",8,0,70,0,,false
1301910219014975488,https://x.com/LandsharkRides/status/1301910219014975488,2020-09-04 15:49:19,she cute,2,0,8,0,https://pbs.twimg.com/media/EhFQb09WkAAaeAq.png,false
1301910419834122240,https://x.com/LandsharkRides/status/1301910419834122240,2020-09-04 15:50:07,"have you read Nietzsche's writing when he realized the Wagners didn't really love him and he got blackpilled? legit some of the saddest stuff I've seen, don't have the pdf on me though",0,0,5,0,,false
1301910773040648193,https://x.com/LandsharkRides/status/1301910773040648193,2020-09-04 15:51:31,"thank you, friend, I do my best",1,0,1,0,,false
1301911208971456513,https://x.com/LandsharkRides/status/1301911208971456513,2020-09-04 15:53:15,"I'd just take Ortho from aristocratic and put it down into prole tier, but Eastern Europe was always poor so we never had much choice",1,0,2,0,,false
1301911612023099398,https://x.com/LandsharkRides/status/1301911612023099398,2020-09-04 15:54:51,b-but physical manifestation mirrors doctrine!,0,0,0,0,,false
1301912026307088386,https://x.com/LandsharkRides/status/1301912026307088386,2020-09-04 15:56:30,"okay this is based 

(but Jesus is also the Sovereign and the Act of Granting)",1,0,4,0,,false
1301912324639522819,https://x.com/LandsharkRides/status/1301912324639522819,2020-09-04 15:57:41,"just rebuilt Trinitarianism thru ur post, got hyped for a sec",0,0,4,0,,false
1301912664831074305,https://x.com/LandsharkRides/status/1301912664831074305,2020-09-04 15:59:02,Collectively Eastern Europe is just the continuation of Byzantium (no I am just bullshitting you're right),0,0,1,0,,false
1301913100455735296,https://x.com/LandsharkRides/status/1301913100455735296,2020-09-04 16:00:46,this is insanely cool,0,0,0,0,,false
1301915773364043777,https://x.com/LandsharkRides/status/1301915773364043777,2020-09-04 16:11:23,"Jesus: The Jubilee

God the Father: The Sovereign

The Holy Ghost: The Act of Granting

Maps perfectly to Trinitarianism. Second accords to the confessional Mystery of Repentance, in third ""Sovereign"" switches to ""sovereign"", this time in the sense of our local lord, the devil.",1,0,15,0,,true
1301916007150350336,https://x.com/LandsharkRides/status/1301916007150350336,2020-09-04 16:12:19,"We shall listen to the Dill-Wife then, she knows best",1,0,2,0,,false
1301916493366652931,https://x.com/LandsharkRides/status/1301916493366652931,2020-09-04 16:14:15,Balkan autism is most powerful autism,0,0,5,0,,false
1301918197906632706,https://x.com/LandsharkRides/status/1301918197906632706,2020-09-04 16:21:01,"Remember that all Three are all Three, so each of these has to be each of the other two too",1,0,0,0,,false
1301918851328872449,https://x.com/LandsharkRides/status/1301918851328872449,2020-09-04 16:23:37,"Telling people to ""go and vote"" is inherently leftist, all true right wingers feel disgusted with voting and regard it as a small but needed humiliation",4,0,116,0,,false
1301919604932050946,https://x.com/LandsharkRides/status/1301919604932050946,2020-09-04 16:26:36,yes.,2,0,4,0,,false
1301920646759419904,https://x.com/LandsharkRides/status/1301920646759419904,2020-09-04 16:30:45,"It's easy. God is the king, satan is the local debauchant duke. I think the tale of Robin Hood explained it in a way quite easy to understand, with Prince John and the rightful King Richard.",1,0,0,0,,false
1301920951215546369,https://x.com/LandsharkRides/status/1301920951215546369,2020-09-04 16:31:57,"Go ye therefore, and teach all nations, baptizing them in the name of the Father, and of the Son, and of the Holy Ghost:",1,0,0,0,,false
1301921152605061122,https://x.com/LandsharkRides/status/1301921152605061122,2020-09-04 16:32:45,God explained this nicely in the parable of the talents,1,0,0,0,,false
1301922042338476033,https://x.com/LandsharkRides/status/1301922042338476033,2020-09-04 16:36:18,"As I have said, to me Blake is no different than Stephen King or John Grisham",1,0,0,0,,false
1301922694112440320,https://x.com/LandsharkRides/status/1301922694112440320,2020-09-04 16:38:53,"Yes, he has great merit, one day I will get to him, I simply mean he is neither a saint nor an evangelist, just a poet... he can come up with stuff, he can engage in mysticism if he wishes, he may say some truth - does not matter. No sainthood, not gonna listen",1,0,0,0,,false
1301922901453668353,https://x.com/LandsharkRides/status/1301922901453668353,2020-09-04 16:39:42,yes peat is big fan,0,0,2,0,,false
1301923172808364032,https://x.com/LandsharkRides/status/1301923172808364032,2020-09-04 16:40:47,"For the Church, the Blake is the Heretic who be trippin... I have picked my side",1,0,0,0,,false
1301924203030081536,https://x.com/LandsharkRides/status/1301924203030081536,2020-09-04 16:44:53,"Yours is just the the mystery of lawlessness... I am the same, everunchanging in my worldview, I am just waiting for you to eventually walk into mystery again, then I will strike again",2,0,1,0,,false
1301924484878872577,https://x.com/LandsharkRides/status/1301924484878872577,2020-09-04 16:46:00,actually yes,1,0,3,0,,false
1301924808951844864,https://x.com/LandsharkRides/status/1301924808951844864,2020-09-04 16:47:17,"bullshit, it's just estrogen, cortisol, and serotonin that fuck it up for the rest",2,0,1,0,,false
1301925450294480898,https://x.com/LandsharkRides/status/1301925450294480898,2020-09-04 16:49:50,"Which champions do you think Tyler1 will end up maining top lane? I think it's gotta be Sion and Wukong, by far they felt most natural to his ways of playing, I'm willing to put a (lindy?)bet on this",2,0,7,0,,false
1301926328246173696,https://x.com/LandsharkRides/status/1301926328246173696,2020-09-04 16:53:19,"I am like 99% sure I was the one to link this to you like two years ago, but you might have also seen it before that, based anyways, it's the best and most honest look at him from them all",1,0,1,0,,false
1301926841020821509,https://x.com/LandsharkRides/status/1301926841020821509,2020-09-04 16:55:22,"There is definitely more merit to him imo, he speaks of very beautiful and wild truths of life, no need to be too diminutive, but yes, ultimately his own biography screeches when exposed to his writings",0,0,4,0,,false
1301927142708719624,https://x.com/LandsharkRides/status/1301927142708719624,2020-09-04 16:56:34,"Well - I've spoken about my personal theory that Nietzsche ended up a Christian, just under the cover of madness, the yurodivy state - can't be proven one way or the other, we'll see one day in the day of days",2,0,3,0,,false
1301927585136414720,https://x.com/LandsharkRides/status/1301927585136414720,2020-09-04 16:58:19,you'll like Dr. Ray Peat's articles if you haven't seen them already,0,0,1,0,,false
1301929302057988097,https://x.com/LandsharkRides/status/1301929302057988097,2020-09-04 17:05:08,,0,0,5,0,https://pbs.twimg.com/media/EhFhy97WsAIUXWq.png,false
1301930141417963520,https://x.com/LandsharkRides/status/1301930141417963520,2020-09-04 17:08:29,"Everything acts with everything, estrogen is usually coupled against progesterone, with zero estrogen you also get fucked though... yes, all of these affect the brain, its states, and thought impacts their levels too, an infinitely complicated system",1,0,1,0,,false
1301935659855351808,https://x.com/LandsharkRides/status/1301935659855351808,2020-09-04 17:30:24,"Every (non-idiotic) heresy is contained (I use the word in the SCP sense of ""restricted"") in orthodoxy",1,0,7,0,,false
1301935728683872256,https://x.com/LandsharkRides/status/1301935728683872256,2020-09-04 17:30:41,t. Chesterton,0,0,4,0,,false
1301936992746438657,https://x.com/LandsharkRides/status/1301936992746438657,2020-09-04 17:35:42,"Seeing Uly sharing normie leftist memes on his IG story and smiling, he's going to make it, he knows what he's doing",1,0,21,0,,false
1301938776747454465,https://x.com/LandsharkRides/status/1301938776747454465,2020-09-04 17:42:47,and yet so familiar!,0,0,1,0,,false
1301947713509093378,https://x.com/LandsharkRides/status/1301947713509093378,2020-09-04 18:18:18,Why the fuck did they perform trepanation on cows,3,0,10,0,,false
1301947995685093377,https://x.com/LandsharkRides/status/1301947995685093377,2020-09-04 18:19:25,I'm pretty sure no one is making any significant money on onlyfans and it's all just a psyop,11,0,91,0,,false
1301948330113748995,https://x.com/LandsharkRides/status/1301948330113748995,2020-09-04 18:20:45,"I mean once you actually become a real popular account that makes more than 20 bucks a month, someone is just going to dump your pics and vids somewhere for free, even boomers are smart enough to just google for them",2,0,45,0,,false
1301948544279031811,https://x.com/LandsharkRides/status/1301948544279031811,2020-09-04 18:21:36,&gt;tfw got a 20 word neuroanatomy dissertation due tomorrow,3,0,34,0,,false
1301949316882456579,https://x.com/LandsharkRides/status/1301949316882456579,2020-09-04 18:24:40,"People go like ""woaah do not sell your soul to satan for earthly riches"", but is this even true? I'm pretty sure even if you're hot and post real filthy shit, you can still hardly make more than at MOST 200 bucks, it's chump change for 99.99% of chicks there",5,0,31,0,,false
1301949587238854657,https://x.com/LandsharkRides/status/1301949587238854657,2020-09-04 18:25:45,it's a copypasta,0,0,2,0,,false
1301952645729529856,https://x.com/LandsharkRides/status/1301952645729529856,2020-09-04 18:37:54,"Complaining about single ply toilet paper is reddit, just roll and stack it into ten-ply toilet paper, use the entire roll in a single time, who's going to stop you? It's free.",6,0,41,0,,false
1301957453282762753,https://x.com/LandsharkRides/status/1301957453282762753,2020-09-04 18:57:00,I should actually write it out now that you say,2,0,3,0,,false
1301958473131982848,https://x.com/LandsharkRides/status/1301958473131982848,2020-09-04 19:01:03,"They have recently reprinted Vince Gironda's books on bodybuilding, if someone is looking to get into the deeper aspects of the art, I suggest you take a look at them, ""The Wild Physique"" is what you should start with, even if it's a bit costly 

<a href=""https://www.vincegironda.com/store/"">vincegironda.com/store/</a>",2,0,7,0,,false
1301958717525635073,https://x.com/LandsharkRides/status/1301958717525635073,2020-09-04 19:02:02,"I continue to sell nothing but shill various unusual curiosities like this, huh",0,0,3,0,,false
1301961761420201985,https://x.com/LandsharkRides/status/1301961761420201985,2020-09-04 19:14:07,"<a href=""/search?q=%23motivation"">#motivation</a> <a href=""/search?q=%23finance"">#finance</a> <a href=""/search?q=%23mindset"">#mindset</a> <a href=""/search?q=%23janoy"">#janoy</a>",1,0,43,0,https://pbs.twimg.com/media/EhF_C6eXgAIgWm6.png;https://pbs.twimg.com/media/EhF_NotXYAMFpA7.jpg,false
1301965678673526784,https://x.com/LandsharkRides/status/1301965678673526784,2020-09-04 19:29:41,"Breathing the fresh air outside my window and wanting to just go out into the late evening and walk eastward in a completely straight line, till morning, till noon, till I reach Jerusalem, or Tibet, or Timbuktu, or Eden, or home, subsisting on the fresh air, and folk-given alms.",1,0,16,0,,false
1301965973474422785,https://x.com/LandsharkRides/status/1301965973474422785,2020-09-04 19:30:52,".<a href=""/Logo_Daedalus"" title=""R.Сам 🦋🐏"">@Logo_Daedalus</a>",0,0,6,0,,false
1301966694617960448,https://x.com/LandsharkRides/status/1301966694617960448,2020-09-04 19:33:44,need a heavy booty bitch in mine,0,0,7,0,,false
1301969091511701504,https://x.com/LandsharkRides/status/1301969091511701504,2020-09-04 19:43:15,"Everything that happened to you, happened for a reason. It was always meant to be, it was always preordained, it was written long before this world was created.

Everything now and coming is yours to choose. You are free to do whatever you want, choose a path.

Zero contradiction",5,0,117,0,,false
1301969779343925254,https://x.com/LandsharkRides/status/1301969779343925254,2020-09-04 19:45:59,"I think this is literally unable to be conceptualized in any way for us, we simply are incapable to understand it in any way. There is no contradiction between free will and fate. It makes sense to you instinctively, doesn't it? You've always known it, and yet it is ""impossible"".",1,0,59,0,,false
1301971285275299842,https://x.com/LandsharkRides/status/1301971285275299842,2020-09-04 19:51:58,Every man has a throne somewhere in the world and sooner or later finds himself sitting on it,3,0,60,0,,false
1301978367240134662,https://x.com/LandsharkRides/status/1301978367240134662,2020-09-04 20:20:06,one arm cable row,0,0,2,0,,false
1301980779841572865,https://x.com/LandsharkRides/status/1301980779841572865,2020-09-04 20:29:42,"Looked up to see if anyone else was using my twitter avi, and there is one guy who does, he is a medic at a Christian healthcare provider and seems redpilled on big pharma, educates young doctors, he even kinda looks like me. What the fuck, avatar physiognomy is literally true",4,0,91,0,,false
1301981116673536001,https://x.com/LandsharkRides/status/1301981116673536001,2020-09-04 20:31:02,reverse google searched the image with twitter keyword,0,0,6,0,,false
1301981820205006850,https://x.com/LandsharkRides/status/1301981820205006850,2020-09-04 20:33:50,This is good,1,0,2,0,,false
1301982503671148549,https://x.com/LandsharkRides/status/1301982503671148549,2020-09-04 20:36:33,"Hello. I was told, by a good and learned friend, that the answer to this question is ""study Rodin's works""",1,0,6,0,,false
1301985085676302337,https://x.com/LandsharkRides/status/1301985085676302337,2020-09-04 20:46:48,"you are likely underrating yourself. a face molds to the person it expresses, a higher, more heroic life is what is best. also, a simpler thing, just get a good haircut and facial hair",1,0,9,0,,false
1301985637516574723,https://x.com/LandsharkRides/status/1301985637516574723,2020-09-04 20:49:00,the sculptor,0,0,1,0,,false
1301988403706241024,https://x.com/LandsharkRides/status/1301988403706241024,2020-09-04 20:59:59,blaq ppo in heaven be liek,1,0,1,0,https://pbs.twimg.com/media/EhGXcUPXkAAQUhw.jpg,false
1301988904770437126,https://x.com/LandsharkRides/status/1301988904770437126,2020-09-04 21:01:59,"wait u agree? i was joking cuz thought ud say their racial characteristics would mold too, not just the skin colour, also nose/hair/jaw, u just want them to be albino?",1,0,0,0,,false
1301993656325468160,https://x.com/LandsharkRides/status/1301993656325468160,2020-09-04 21:20:52,"If there is any ""futuristic"" speculative reading of Genesis, it should be preemptively learning the lesson that human blood and genome should in no way be polluted through any means",1,0,27,0,,false
1301994519420952576,https://x.com/LandsharkRides/status/1301994519420952576,2020-09-04 21:24:17,"Gene Wolfe makes a short reference to this in the ""green man"" character coming from the far future, when mankind has put ""river scum"" inside their bodies and thus turned autotrophic - causing Severian immediately to realize that the creature is not actually human, but smth else",1,0,25,0,,false
1301995813967728641,https://x.com/LandsharkRides/status/1301995813967728641,2020-09-04 21:29:26,"I guess cynocephali (who might lurk in a corner of time, instead of in a corner of current earth) were an opportunity for theology to encounter the problem of such creatures directly, like St. Christopher morphing into pure man after truly accepting Christ",1,0,15,0,,false
1301996585186885632,https://x.com/LandsharkRides/status/1301996585186885632,2020-09-04 21:32:30,"""I wonder what this mea- oh wait""",0,0,1,0,,false
1301997998164115461,https://x.com/LandsharkRides/status/1301997998164115461,2020-09-04 21:38:07,"Being too avoidant of vulgarity, a very vulgar thing itself",2,0,55,0,,false
1301999180668338177,https://x.com/LandsharkRides/status/1301999180668338177,2020-09-04 21:42:49,"an architect too afraid of vulgarity will build a building without a shitter, of no good use to anyone",1,0,27,0,,false
1302001577918713859,https://x.com/LandsharkRides/status/1302001577918713859,2020-09-04 21:52:20,"""There is no event in the cosmos, no matter how mundane it may seem, that is not infinitely purposeful in the Creator’s plan."" this should not be seen as neuroticism, as the act of a demiurge obsessively minmaxing all matter, but as the eternal peace of a God thru which all flows",2,0,46,0,,false
1302002460836405249,https://x.com/LandsharkRides/status/1302002460836405249,2020-09-04 21:55:51,"God walking in front of His people not with calculated gait like a kid trying not to step on sidewalk cracks, but with confident stride of divinity, knowing they are to follow, every angle symbolic in unseen and incalculable ways",0,0,17,0,,false
