id,url,time,text,replies,retweets,likes,views,media,has_quote
1229461495299366912,https://x.com/LandsharkRides/status/1229461495299366912,2020-02-17 17:43:57,"Apparently while the anesthesia was starting to wear off I was moaning ""damn this shit feels good"" while slipping in and out of consciousness",6,1,86,0,,false
1229463549778550785,https://x.com/LandsharkRides/status/1229463549778550785,2020-02-17 17:52:07,"It is curious to remember that bones are organs, even if we tend to not think of them as such. They produce blood cells... Your skull is an organ, Prince Hamlet held an organ in the air and talked to it. There are organs inside your fingers.",5,7,121,0,,false
1229506535044403210,https://x.com/LandsharkRides/status/1229506535044403210,2020-02-17 20:42:55,Skin is a parasite,0,0,3,0,,false
1229510280520048650,https://x.com/LandsharkRides/status/1229510280520048650,2020-02-17 20:57:48,"High DHT + High MSH = monarchist (heightened animalistic nature, respectful of natural order)

Ram-testosterone injection = futurist

High melancholic humours, lesser level of phlegma = reactionary

High epinephrine = u/acc

Low orgone = Malthusianism / pro-NWO / anti-greenpill.",6,3,64,0,,true
