id,url,time,text,replies,retweets,likes,views,media,has_quote
1506530271998398466,https://x.com/LandsharkRides/status/1506530271998398466,2022-03-23 07:16:21,"Always find it funny seeing the ""DO NOT CONSUME IF PREGNANT OR NURSING"" warnings on Red Bull cans, imagining a last trimester woman sipping it down and her baby getting absolutely turnt up in the womb, stimming out, fucked up",2,0,121,0,,false
1506587147461177347,https://x.com/LandsharkRides/status/1506587147461177347,2022-03-23 11:02:21,Everyone gangsta till the fat n1gga start repping out pullups,2,0,138,0,,false
1506589577976463360,https://x.com/LandsharkRides/status/1506589577976463360,2022-03-23 11:12:01,Ngl dawg i would devour this,2,0,44,0,,false
1506594261000671237,https://x.com/LandsharkRides/status/1506594261000671237,2022-03-23 11:30:37,If this mf come to my lecture im sneezing in his face,0,0,2,0,,false
1506597348872527875,https://x.com/LandsharkRides/status/1506597348872527875,2022-03-23 11:42:53,,8,0,79,0,https://pbs.twimg.com/media/FOiCTeyXEAknBDH.jpg,false
1506614382834462722,https://x.com/LandsharkRides/status/1506614382834462722,2022-03-23 12:50:35,"American RW: Damn. I donated 10$ to xGroyp69 and he shouted my name out on the political live stream!.

European far-right extremist: Had some mayonnaise pork spleen burger at the soccer game today, sadly my Algerian girlfriend can't eat pork so I had to drive her to the Lidl....",6,0,195,0,,false
1506617894855233548,https://x.com/LandsharkRides/status/1506617894855233548,2022-03-23 13:04:32,Like competitive 5 hours a day for years,0,0,2,0,,false
1506618073087987714,https://x.com/LandsharkRides/status/1506618073087987714,2022-03-23 13:05:14,This is literally the most true thing I've ever typed out wtf,7,0,181,0,,false
1506619280196050950,https://x.com/LandsharkRides/status/1506619280196050950,2022-03-23 13:10:02,"""Reports of Yekaterinburg bears waking up from hibernation. Still officially unconfirmed as of this moment, will delete if not real. News coming in form Russian channels so take it with a grain of salt.""",0,0,93,0,,false
1506624414468743171,https://x.com/LandsharkRides/status/1506624414468743171,2022-03-23 13:30:26,"Few days ago at the gym was doing bench, running on no food, so I had one late Millennial norwood guy spot me, and he literally just pulled the barbell up mid-rep 5 times in a row without me even struggling and said ""that's too much weight for you"", literally left me speechless",7,0,221,0,,false
1506624986118828036,https://x.com/LandsharkRides/status/1506624986118828036,2022-03-23 13:32:43,"It was not even like an Alpha mogging weaker people thing, I am noticeably larger and stronger than him, literally just soylennial seethe at sm1 younger pushing more than him or low iq. Worst spot ive had and last summer i had a zoomer buddy almost accidentall murder me spotting",3,0,179,0,,false
1506626294066339843,https://x.com/LandsharkRides/status/1506626294066339843,2022-03-23 13:37:54,Imagine if u do urine therapy afterwards.. No gains wastd..,1,0,9,0,,false
1506630988188823556,https://x.com/LandsharkRides/status/1506630988188823556,2022-03-23 13:56:34,"""it's over""",1,0,8,0,,false
1506631275263758343,https://x.com/LandsharkRides/status/1506631275263758343,2022-03-23 13:57:42,Insane phrenology,1,0,0,0,https://pbs.twimg.com/media/FOihKO5XsAYsYSw.jpg,false
1506631653359292428,https://x.com/LandsharkRides/status/1506631653359292428,2022-03-23 13:59:12,Mashallah,0,0,1,0,,false
1506660103767965714,https://x.com/LandsharkRides/status/1506660103767965714,2022-03-23 15:52:15,"&gt;sit alone only person front row at the lecture
&gt;girl comes crosses the entire room and sits next to me",8,0,333,0,https://pbs.twimg.com/media/FOi7YSTXoAUER4m.jpg,false
1506660639854501895,https://x.com/LandsharkRides/status/1506660639854501895,2022-03-23 15:54:23,no way this is fucking real,1,0,0,0,,false
1506661330081701891,https://x.com/LandsharkRides/status/1506661330081701891,2022-03-23 15:57:08,Fuckkkk,0,0,0,0,,false
1506662591027978244,https://x.com/LandsharkRides/status/1506662591027978244,2022-03-23 16:02:08,Lmfao,0,0,2,0,,false
1506664519854088194,https://x.com/LandsharkRides/status/1506664519854088194,2022-03-23 16:09:48,Meds. Now.,10,0,51,0,,false
1506669126726606859,https://x.com/LandsharkRides/status/1506669126726606859,2022-03-23 16:28:07,"Is anyone else able to do a shitton more pullups in spring/summer? Not outdoors, even in a regular temperature gym in winter I can do barely like five pullups, once it's sunny out I can rep them out by the dozen easily and they don't feel ""taxing"" on the CNS but more like dancing",11,0,102,0,,false
1506669894980485130,https://x.com/LandsharkRides/status/1506669894980485130,2022-03-23 16:31:10,"Like I posted about this, cats lie around and nap all winter and get more active in spring, but with other  exercises it's not as drastic, I can still press normally, row, but on pullups it's a completely different feeling, it's like you're literally lighter",5,0,55,0,,false
1506671035030122500,https://x.com/LandsharkRides/status/1506671035030122500,2022-03-23 16:35:42,Reign of quantity......,0,0,0,0,,false
1506673249677197327,https://x.com/LandsharkRides/status/1506673249677197327,2022-03-23 16:44:30,Haidut mentioned,1,0,16,0,https://pbs.twimg.com/media/FOjHVBcX0AAm_yi.jpg,false
1506673844005871635,https://x.com/LandsharkRides/status/1506673844005871635,2022-03-23 16:46:51,"Well carrots are just a source of fiber that is not digestible by bacteria, not really meant for any other effects. NO is pretty bad, but I don't think there is a problem with having beets if you like them, they are tasty, just avoiding meds that increase NO and like beet powders",0,0,0,0,,false
1506674264132493315,https://x.com/LandsharkRides/status/1506674264132493315,2022-03-23 16:48:31,"Nah I was like 88 in winter and 91 right now, it's not just the red light eighter as I have a lamp, I really think it's not reducible to the separate factors except night being shorter",1,0,6,0,,false
1506676269596954637,https://x.com/LandsharkRides/status/1506676269596954637,2022-03-23 16:56:30,"I really hate how any nutrition principles are seen through a lens of sports performance and weight loss/gain, because promoting avoiding PUFA, ""seed oils"" means not that your (young able male) squat will skyrocket and you get jacked, but that your aunt won't get cancer at age 59",5,0,251,0,,false
1506677199352606727,https://x.com/LandsharkRides/status/1506677199352606727,2022-03-23 17:00:11,"Like when you're 24 you can chug beer and eat deep soy zogslop all day long before benching 3 plates and still having visible abs on top, but there are a lot of people who will suffer slow, chronic disease for decades, sustained on monstrous substances that are easily avoided",2,0,174,0,,false
1506677518048317440,https://x.com/LandsharkRides/status/1506677518048317440,2022-03-23 17:01:27,"Yeah it gives you crazy pumps but long term is not that good, on occasion it's ok to use it for an occasional all out session I guess",0,0,0,0,,false
1506677874358689802,https://x.com/LandsharkRides/status/1506677874358689802,2022-03-23 17:02:52,"Well the PUFA stacks up. It's not like it magically becomes worse after you turn 50, better to start thinking about it now than later",0,0,4,0,,false
1506681129654538247,https://x.com/LandsharkRides/status/1506681129654538247,2022-03-23 17:15:48,"&gt;socialism, conservative communism
&gt;labor unions, ""labor history""
&gt;class analysis/class solidarity/etc.
&gt;Gramsci, Marx, Engels, Lenin

Instant ticket back to reddit, should discredit anything else you are interested in and guarantee any art you have created to be mediocre at best",9,0,125,0,,false
1506682239488307211,https://x.com/LandsharkRides/status/1506682239488307211,2022-03-23 17:20:13,"Charities are so ZOG, it's a way to guilt poor people into basically paying extra taxes, a way to launder money and probably kidnap thrid world kids for pedo shit, have the masses internalize it's not the state's job to take care of those who need it, just a total evil meme",13,0,258,0,,false
1506683377486864391,https://x.com/LandsharkRides/status/1506683377486864391,2022-03-23 17:24:44,I literally have worn nothing but sweatpants like 3 years now,5,0,90,0,,false
1506683488719753220,https://x.com/LandsharkRides/status/1506683488719753220,2022-03-23 17:25:11,You know there are like hidden ones right,1,0,15,0,,false
1506684975386611715,https://x.com/LandsharkRides/status/1506684975386611715,2022-03-23 17:31:05,Dawg whats this second pic 💀💀,2,0,109,0,,false
1506691201055039488,https://x.com/LandsharkRides/status/1506691201055039488,2022-03-23 17:55:49,LMFAO,0,0,61,0,,false
1506691510863081473,https://x.com/LandsharkRides/status/1506691510863081473,2022-03-23 17:57:03,It's just that Dali makes everyone else redundant,0,0,9,0,,false
1506693511936364550,https://x.com/LandsharkRides/status/1506693511936364550,2022-03-23 18:05:00,Mussolinic,2,0,112,0,,true
1506701555612987398,https://x.com/LandsharkRides/status/1506701555612987398,2022-03-23 18:36:58,It's sorta funny because Evola did a shitton of drugs at one early point and Ray Peat is exactly as described above in the OP but also there is no contradiction,0,0,11,0,,false
1506703169035902990,https://x.com/LandsharkRides/status/1506703169035902990,2022-03-23 18:43:23,Which one is it,1,0,0,0,,false
1506706460142624769,https://x.com/LandsharkRides/status/1506706460142624769,2022-03-23 18:56:28,Ty king ill cheq out,0,0,0,0,,false
1506711713823051795,https://x.com/LandsharkRides/status/1506711713823051795,2022-03-23 19:17:20,"Is mathematical knot theory in the ""wordcel"" or ""shape rotator"" category? It's quite fascinating, almost like the ""100 000 angels dancing on the tip of a needle"" turned into a science of its own. I am also quite attracted to female knot theory graduates as an example of autism...",11,0,92,0,,false
1506713119015546890,https://x.com/LandsharkRides/status/1506713119015546890,2022-03-23 19:22:55,If I met a female knot theory professor I would simply propose to her on the spot and spend the rest of my life talking with her about how many 5D knots you can theoretically tie on an indefinite line or some shit like that and trying to think out the philosophical implications..,6,0,52,0,,false
1506713301627060226,https://x.com/LandsharkRides/status/1506713301627060226,2022-03-23 19:23:39,Are you a female knot theory student by any chance  ?,1,0,4,0,,false
1506713649372614656,https://x.com/LandsharkRides/status/1506713649372614656,2022-03-23 19:25:02,Its over,0,0,3,0,,false
1506714013287264267,https://x.com/LandsharkRides/status/1506714013287264267,2022-03-23 19:26:28,"This is the most human hornypost you've made, something for the common man to relate to",1,0,54,0,,false
1506714105842917378,https://x.com/LandsharkRides/status/1506714105842917378,2022-03-23 19:26:50,It's over,0,0,9,0,,false
1506733021818466312,https://x.com/LandsharkRides/status/1506733021818466312,2022-03-23 20:42:00,Lotschental is where they take the guards for the Pope you know it right? Also the place Mena talked about where like bread and cheese have more nutrients because of the rich soil,1,0,11,0,,false
