id,url,time,text,replies,retweets,likes,views,media,has_quote
1586237188416491520,https://x.com/LandsharkRides/status/1586237188416491520,2022-10-29 06:03:11,cheers,0,0,3,0,,false
1586237327533543425,https://x.com/LandsharkRides/status/1586237327533543425,2022-10-29 06:03:44,😈😈,0,0,0,0,,false
1586241830265520129,https://x.com/LandsharkRides/status/1586241830265520129,2022-10-29 06:21:37,"""Overly reductionist, such small amount of sugar is unlikely to have an effect. Various phenomena fall under the label of Placebo, but the archetypal meeting between healer and patient is the most important part. Many 30 IQ doctors have good outcome results just by being caring.""",4,0,83,0,,true
1586245631240458240,https://x.com/LandsharkRides/status/1586245631240458240,2022-10-29 06:36:44,"Failure of the imagination. A household dog does not require a forest's depiction on the wall and will not care for it. It's possible to create a truly stimulating environment fit for any animal's innate character, that does not merely imitate wild nature, but stands on its own.",3,0,201,0,,true
1586246877485617152,https://x.com/LandsharkRides/status/1586246877485617152,2022-10-29 06:41:41,It looks pathetic because the best they could figure out was take an animal outside its environment and place it in a concrete room with a picture of the previous thing on the wall. E.g. my parrot just does not care about any jungle documentaries because he prefers his apartment.,7,0,125,0,,false
1586247486242291713,https://x.com/LandsharkRides/status/1586247486242291713,2022-10-29 06:44:06,,0,0,13,0,https://pbs.twimg.com/media/FgN7rSoWAAAny1y.jpg,false
1586249038802087936,https://x.com/LandsharkRides/status/1586249038802087936,2022-10-29 06:50:16,I'm betting on that one guy myself but that's just me,0,0,17,0,,false
1586256254712049664,https://x.com/LandsharkRides/status/1586256254712049664,2022-10-29 07:18:56,"I remember someone on 4chan /pol/ said he used to work as ""white guy"" in China. Some local mafia types/businessmen there would hire him to go to meetings and events with them, because it was seen as prestigious to have a white friend, and pretended they had ""western connections"".",24,0,732,0,,false
1586258127175192577,https://x.com/LandsharkRides/status/1586258127175192577,2022-10-29 07:26:23,"""Hoho, Lu Xin, your ""white"" friend seem little swarthy to my eye... Where you find him? Mexico?""

""Silence, Xin Zhu! I will hear no more this foolishness. John Smith is fully white American man, he trace his fully American ancestry back 6000 years!! Your Western friend is dog!!!""",5,0,504,0,,false
1586267533086449664,https://x.com/LandsharkRides/status/1586267533086449664,2022-10-29 08:03:45,"My favorite pages of Evola, from the mountaineering book",4,0,90,0,https://pbs.twimg.com/media/FgONpTBXoAA7gRS.png;https://pbs.twimg.com/media/FgONp1cWAAAV2cC.png,false
1586268261930635264,https://x.com/LandsharkRides/status/1586268261930635264,2022-10-29 08:06:39,Mount Langkofel,3,0,35,0,https://pbs.twimg.com/media/FgOOeGsXwAEEA4S.png;https://pbs.twimg.com/media/FgOOgCjXkAAXan7.png;https://pbs.twimg.com/media/FgOOkfYWQAAgLJN.jpg,false
1586268386979217408,https://x.com/LandsharkRides/status/1586268386979217408,2022-10-29 08:07:09,,0,0,30,0,https://pbs.twimg.com/media/FgOOrJXXkAEiD2c.png,false
1586268469921816577,https://x.com/LandsharkRides/status/1586268469921816577,2022-10-29 08:07:29,tell,1,0,7,0,,false
1586270015048757249,https://x.com/LandsharkRides/status/1586270015048757249,2022-10-29 08:13:37,I had a post about this. Asking girls out is something us poor guys have to do. Mafia bosses just tell one of their men to go and talk to the girl they saw for them and it works because it just makes them seem more important/powerfully distant. It's like a shabbos goy for dating.,8,0,403,0,,true
1586271187797442563,https://x.com/LandsharkRides/status/1586271187797442563,2022-10-29 08:18:17,"You can't imagine Herr Putin going up to a girl and stuttering out. You just send one of your servants to deal with the dirty necessity of arrangements. To the femoid, the entire thing should feel like a magical journey to the Wizard of Oz's chambers, dream-like state throughout.",0,0,221,0,,false
1586275221606391808,https://x.com/LandsharkRides/status/1586275221606391808,2022-10-29 08:34:19,,7,0,194,0,https://pbs.twimg.com/media/FgOU57qWIAYvoNN.jpg,false
1586276281636687873,https://x.com/LandsharkRides/status/1586276281636687873,2022-10-29 08:38:31,"I am pretty sure you can get corrective surgery for it, no? But still I would inform your family if I were you, they deserve to know imo.",0,0,0,0,,false
1586304008649515008,https://x.com/LandsharkRides/status/1586304008649515008,2022-10-29 10:28:42,"To a creationist, all evolutionary early mankind speculation takes the role of play, thus Gene Wolfe's pheromone-based tribes before fire and Ray Peat's Kilimanjaro mountain watermelon farmers and Nilotic sugar grass monkeys.",3,0,75,0,,false
1586304011560706048,https://x.com/LandsharkRides/status/1586304011560706048,2022-10-29 10:28:43,"This is also why I am allowed to point out bigfoots throwing stones is like early mankind's most effective potential hunting strategy as per Varg Vikernes' ""brutal stone age technology"" video and also Mr. Gait Analyst promised me a Bigfoot gait analysis thread but is offsite rn.",1,0,38,0,,false
1586309659228622851,https://x.com/LandsharkRides/status/1586309659228622851,2022-10-29 10:51:09,"I automatonically like any restaurant, inn, etc. that has a tree in the middle between the tables because cutting it would be easy but they on purpose left it standing and had to work around it. Same logic goes for letting swallows nest under the roof instead of exiling them out.",2,0,105,0,,false
1586321554966999040,https://x.com/LandsharkRides/status/1586321554966999040,2022-10-29 11:38:25,"My gut leases itself out over the most inergonomic chair, in the insides of my office. A powerful thrust through my posterior chain mobilizes me on my feet, as an embolic deep vein thrombus travels up to block at my very heart. As I choke dying, I see Goethe welcome me in Heaven.",0,0,175,0,,false
1586350984477159424,https://x.com/LandsharkRides/status/1586350984477159424,2022-10-29 13:35:22,Wait a minute...,1,0,19,0,,false
1586354603154878464,https://x.com/LandsharkRides/status/1586354603154878464,2022-10-29 13:49:45,FACT: Oswald Spengler would have SUPPORTED the NSDAP if Adolf Hitler was an Australian aboriginal tribesman.,6,0,119,0,,false
1586356418101116929,https://x.com/LandsharkRides/status/1586356418101116929,2022-10-29 13:56:57,"I might not have touched any vidya for many years myself, but still, when I see the Steam icon on someone's taskbar, I sense a sense of camaraderie. The 2011 Valve corporation has touched upon his laptop too. It might not be true kino like Counter-Strike 1.6, but he has Partaken.",6,0,250,0,,false
1586356513928466432,https://x.com/LandsharkRides/status/1586356513928466432,2022-10-29 13:57:20,Thrice so if the man is a professor or a doctor.,0,0,74,0,,false
1586358957257666560,https://x.com/LandsharkRides/status/1586358957257666560,2022-10-29 14:07:03,"""His ideological rigidity precedes any connections he has to Russia's security services, stretching back at least to his days at Moscow Institute. There, Strelkov obsessed over military history and joined a small but vocal group of students, who advocated a return to monarchism.""",1,0,100,0,,true
1586364570880573440,https://x.com/LandsharkRides/status/1586364570880573440,2022-10-29 14:29:21,Theophylline vs Caffeine molecule. They look sorta similar. Makes you think... (I failed biochemistry),11,0,102,0,https://pbs.twimg.com/media/FgPliWSWAAAFzpg.png;https://pbs.twimg.com/media/FgPllXBXkAAPTbA.png,true
1586369649213865984,https://x.com/LandsharkRides/status/1586369649213865984,2022-10-29 14:49:32,"""I am short, obese, with dark hair, look like a low IQ ghetto idiot and am unnaturally loud but caring. But it was very nice meeting you too, see you again soon.""",3,0,127,0,,false
1586369741475684355,https://x.com/LandsharkRides/status/1586369741475684355,2022-10-29 14:49:54,just delicious together,0,0,1,0,,false
1586371037557448705,https://x.com/LandsharkRides/status/1586371037557448705,2022-10-29 14:55:03,,0,0,170,0,https://pbs.twimg.com/media/FgPsC_3XEAETRo3.jpg,false
1586372170779086848,https://x.com/LandsharkRides/status/1586372170779086848,2022-10-29 14:59:33,No no no no completely opposite get as much coffee as you can,0,0,11,0,,false
1586372461192531971,https://x.com/LandsharkRides/status/1586372461192531971,2022-10-29 15:00:42,Currently I have zero failed classes,1,0,4,0,,false
1586375501329100805,https://x.com/LandsharkRides/status/1586375501329100805,2022-10-29 15:12:47,"Basically everyone who says life is a game is technically correct, but is also miserably failing at it. Bongcloud or Coca-Cola gambit tier bad. Doing the equivalent of teamkilling in CS or letting yourself get backdoored. The people winning at the game are all saints.",4,0,149,0,,false
1586375712537468928,https://x.com/LandsharkRides/status/1586375712537468928,2022-10-29 15:13:37,I prefer coffee,0,0,1,0,,false
1586376202196987904,https://x.com/LandsharkRides/status/1586376202196987904,2022-10-29 15:15:34,Basically anyone who's not a monastic is stuck in a minigame sidequest and not progressing with the main storyline,7,0,102,0,,false
1586379953989332998,https://x.com/LandsharkRides/status/1586379953989332998,2022-10-29 15:30:29,"Went on a roadtrip to an inn which serves duck liver with fig jam and homemade walnut ice cream. Long walk for healthful digestion, saw a lake with a tower in the middle where birds nest. Top it off with a Carlsbad article afterwards at home. This is how it feels being Bulgarian.",3,0,153,0,,false
1586386502325764098,https://x.com/LandsharkRides/status/1586386502325764098,2022-10-29 15:56:30,"RE: Daylight savings time, summer time is 1000000x better than winter time, anything that makes the day feel longer is good. I want a midnight sunset. Ideally all of sleep should be occurring inside the dark part of the day/night cycle, to prevent nighttime mitochondrial damage.",12,0,247,0,,false
1586387835338235905,https://x.com/LandsharkRides/status/1586387835338235905,2022-10-29 16:01:48,"We should just keep the summer version forever. Waking up when it's dark outside is fun, feels like a farmer getting up 4 AM to milk the cows. You get to see the sunrise on your way to work, it wakes you up well. +Can have a cup of coffee in the dawn's gentle light if unemployed.",2,0,136,0,,false
1586389186818543617,https://x.com/LandsharkRides/status/1586389186818543617,2022-10-29 16:07:10,they are both sort of serpentine,0,0,8,0,,false
1586391114470330370,https://x.com/LandsharkRides/status/1586391114470330370,2022-10-29 16:14:50,"A recent study (Anammelech, et al., 4000 BC)",3,0,70,0,,true
1586392307347382273,https://x.com/LandsharkRides/status/1586392307347382273,2022-10-29 16:19:34,I would definitely avoid them,0,0,1,0,,false
1586414949038886913,https://x.com/LandsharkRides/status/1586414949038886913,2022-10-29 17:49:32,"Dr. Ray Peat inspired dirty winter bulk: 2 pounds of potatoes, well-cooked with butter and chased with indigestible fiber, G.O.M.A.D., 1 liter of orange juice, liter of fresh grape juice, can of coke, liberal liver pate, unlimited amount of ice cream, chocolate, buckets of fruit.",19,0,425,0,,false
1586416246593314816,https://x.com/LandsharkRides/status/1586416246593314816,2022-10-29 17:54:42,"If you're a gymcel, you can do the perfect giga bulk without feeling like shit about it as long as you avoid PUFA foods, put 15 lbs. of mass on in a couple months and go bear mode, yoke carries, rack pulls, cheat rows, cheat curls, OHP numbers skyrocket because ""mass moves mass"".",1,0,166,0,,false
1586416944042868736,https://x.com/LandsharkRides/status/1586416944042868736,2022-10-29 17:57:28,twice a week is ok he says but that's like the safe dose for old women too,0,0,10,0,,false
1586417889133092865,https://x.com/LandsharkRides/status/1586417889133092865,2022-10-29 18:01:13,"Watch the AlphaDestiny yoke training playlist and the Eric Bugenhagen talk videos on compounds and eating a ton of food, read the Peat articles on nutrition or straight up the ""Nutrition for Women"" book (PDF online). 5000 calories a day minimum daily throughout this Nov/December.",1,0,137,0,https://pbs.twimg.com/media/FgQWlTTXgAASkkS.png,false
1586418005868777472,https://x.com/LandsharkRides/status/1586418005868777472,2022-10-29 18:01:41,i buy because i am super lazy but it's easy af to make,0,0,2,0,,false
1586418599916339200,https://x.com/LandsharkRides/status/1586418599916339200,2022-10-29 18:04:03,,2,0,19,0,https://pbs.twimg.com/media/FgQXI_ZXkAIqJFJ.png;https://pbs.twimg.com/media/FgQXRvOWAAAsbdZ.png,false
1586420626176495616,https://x.com/LandsharkRides/status/1586420626176495616,2022-10-29 18:12:06,mex,0,0,0,0,,false
1586425834348609536,https://x.com/LandsharkRides/status/1586425834348609536,2022-10-29 18:32:47,ill bring one back sooner or later,2,0,7,0,,false
1586428253778083842,https://x.com/LandsharkRides/status/1586428253778083842,2022-10-29 18:42:24,have not yet,1,0,1,0,,false
1586435312754266112,https://x.com/LandsharkRides/status/1586435312754266112,2022-10-29 19:10:27,"A plant reaches up blindly in the dark until it feels sunlight (Gene Wolfe's ""Morning-Glory"" short story explores this w/ vines navigating mazes), while a rock always tumbles down, seawater flows to the lowest point bound. Even the stones cry out *after* the apostles fall silent!",1,0,67,0,,false
1586435310522494976,https://x.com/LandsharkRides/status/1586435310522494976,2022-10-29 19:10:27,"I think the difference between mineral intelligence (river log driving systems, moisture cave cycles, computer algorithms, avalanche and floods) and plant intelligence is minerals lack intuition while plants possess it.",3,0,96,0,,false
1586435985348304897,https://x.com/LandsharkRides/status/1586435985348304897,2022-10-29 19:13:08,"The association between breast implants for females and scleroderma disease seems simple scientifically (silicone acts as an adjuvant, making exposure to irritants, solvents, or infections more harmful; as per Dr. Ray Peat), but is far more disturbing on the symbological level...",2,0,71,0,,false
1586436739823853568,https://x.com/LandsharkRides/status/1586436739823853568,2022-10-29 19:16:08,"I really like this essay by a friend of mine talking about Schmitt feeling similarly about the ""new regime"" and even comparing himself to Melville's character stuck on a ship after a secret slave revolt, very good read. I'll check the book out, thank you 

<a href=""https://noeticpirate.substack.com/p/carl-schmitt-among-the-negroes-benito-cereno-as-the-reactionary-intellectual-ae1f8d2bd76f"">noeticpirate.substack.com/p/…</a>",0,0,6,0,,false
1586440325333131267,https://x.com/LandsharkRides/status/1586440325333131267,2022-10-29 19:30:22,yeah but not a big fan,0,0,0,0,,false
1586442077394857984,https://x.com/LandsharkRides/status/1586442077394857984,2022-10-29 19:37:20,AHHHHHHHHHHHHHHHHHHHHHHH,0,0,0,0,,false
1586449835003027456,https://x.com/LandsharkRides/status/1586449835003027456,2022-10-29 20:08:10,"People are way too dismissive of ancient Chinese culture, when Julius Evola quotes Confucian texts and Taoism almost as much as Hindoo ones in ""Revolt"", even opening the book with such a quotation. Yi people are of Aryan origin (funnily enough meaning ""black"" instead of ""white"").",1,0,58,0,https://pbs.twimg.com/media/FgQzKuUXEAARSlL.jpg;https://pbs.twimg.com/media/FgQzL33WAAA_cr_.png;https://pbs.twimg.com/media/FgQzXjSXEAEchTm.png;https://pbs.twimg.com/media/FgQzn1lWIAY8RSC.png,false
1586450100011732993,https://x.com/LandsharkRides/status/1586450100011732993,2022-10-29 20:09:13,🙏🙏,0,0,1,0,,false
1586451393916780544,https://x.com/LandsharkRides/status/1586451393916780544,2022-10-29 20:14:21,One thing I don't like about those neoreaction types is they don't have faith in us low IQ guys. We can be pretty plucky if left to our own devices. Just makes no sense to force us to work as street sweepers when we can do decent job as doctors if no one examines us up too close.,11,0,249,0,,false
1586456431066480640,https://x.com/LandsharkRides/status/1586456431066480640,2022-10-29 20:34:22,"Ray Peat mentions that constipation is often a sign of an incoming stroke in old people. If grandpa, old relatives, etc. cannot go to toilet for a prolonged time, good to recommend them cascara/emodin and aspirin which are anti-inflammatory on intestine, even castor oil laxative.",4,0,232,0,,false
1586457344762085376,https://x.com/LandsharkRides/status/1586457344762085376,2022-10-29 20:38:00,"Really modern medicine sorta just forgot how dangerous constipation is (which we knew!), endotoxin leaking into the circulation and affecting all organs, blood pressure spiking, bacterial load on intestine, serotonin. An excretion per day is essential, especially in older people.",3,0,108,0,,false
1586464019770023936,https://x.com/LandsharkRides/status/1586464019770023936,2022-10-29 21:04:32,I think there's a lot of purposeful misinformation on cascara in general,0,0,4,0,,false
1586471314763546624,https://x.com/LandsharkRides/status/1586471314763546624,2022-10-29 21:33:31,"I don't think I have to even spell it out, but I always 100% support BAP, unconditionally and absolutely. He's always been here for me and my friends when we needed it. Absolutely pure in intentions and sincerity as a man. Will reach out to help, even if he's severely underslept.",17,0,589,0,,false
1586471788237975552,https://x.com/LandsharkRides/status/1586471788237975552,2022-10-29 21:35:24,"BAP has saved more lives from quiet despair than any modern thinker. Basically every time I talk to someone 16-19 years old, who read his book when he was in highschool, he's insanely smart and already on track to a career where it matters. No wonder he has many powerful enemies.",4,0,374,0,,false
1586472019016966144,https://x.com/LandsharkRides/status/1586472019016966144,2022-10-29 21:36:19,Basically BAP is the best and everyone who knows him loves him for a good reason,9,0,293,0,,false
1586474278383255552,https://x.com/LandsharkRides/status/1586474278383255552,2022-10-29 21:45:17,it takes like 2 hours it's a very short book,2,0,5,0,,false
1586474508575088640,https://x.com/LandsharkRides/status/1586474508575088640,2022-10-29 21:46:12,once or twice,1,0,1,0,,false
1586478177353867266,https://x.com/LandsharkRides/status/1586478177353867266,2022-10-29 22:00:47,"""He does not actually take anything related to religion too seriously""",1,0,22,0,,false
1586485615708758016,https://x.com/LandsharkRides/status/1586485615708758016,2022-10-29 22:30:20,"I've mentioned this before, but discussing it with a friend, and Stephen Hawking lived for 50 years with ALS and no one is sure how he survived so long, but he has a quote comparing black holes with aspirin dissolving in a glass of water so I'm pretty sure he did a shitton of it.",5,0,226,0,,false
1586485833896296448,https://x.com/LandsharkRides/status/1586485833896296448,2022-10-29 22:31:12,"""Hawking's most important scientific legacy is his idea that black holes slowly dissolve like aspirin in a glass of water."" - there is no way you make that exact comparison that's not *that* intuitive unless you see aspirin often enough for the image of it to persist in your mind",2,0,143,0,,false
1586486334939488256,https://x.com/LandsharkRides/status/1586486334939488256,2022-10-29 22:33:12,u are actually super likeable....,2,0,20,0,,false
1586488327942787072,https://x.com/LandsharkRides/status/1586488327942787072,2022-10-29 22:41:07,wait u think he was just a regular healthy guy who pretended to be in a wheelchair fucked up unable to speak,4,0,39,0,,false
1586488387464306695,https://x.com/LandsharkRides/status/1586488387464306695,2022-10-29 22:41:21,cheers bro,1,0,1,0,,false
1586488931125964800,https://x.com/LandsharkRides/status/1586488931125964800,2022-10-29 22:43:31,"Like both my bro and me tried to find any mention on his actual aspirin regiment but there is zero information whatsoever so this is all in the speculation domain but Dr. Ray Peat mentioned a few grams of aspirin being able to keep ALS at bay, friend of Peat did for many decades.",1,0,97,0,,false
1586490478786400256,https://x.com/LandsharkRides/status/1586490478786400256,2022-10-29 22:49:40,,2,0,54,0,https://pbs.twimg.com/media/FgRYjLRXkAIgyFM.png,false
1586491033268862976,https://x.com/LandsharkRides/status/1586491033268862976,2022-10-29 22:51:52,yess,0,0,1,0,,false
1586491429655674881,https://x.com/LandsharkRides/status/1586491429655674881,2022-10-29 22:53:27,they probably play a part,0,0,1,0,,false
