id,url,time,text,replies,retweets,likes,views,media,has_quote
1594939679463325698,https://x.com/LandsharkRides/status/1594939679463325698,2022-11-22 06:23:46,0,7,0,329,0,,false
1594943164766355456,https://x.com/LandsharkRides/status/1594943164766355456,2022-11-22 06:37:37,White beard groomed like this,0,0,1,0,https://pbs.twimg.com/media/FiJgWdbWQAAeG6K.jpg,false
1594944460223545344,https://x.com/LandsharkRides/status/1594944460223545344,2022-11-22 06:42:46,Cheers,0,0,3,0,,false
1594944743439572993,https://x.com/LandsharkRides/status/1594944743439572993,2022-11-22 06:43:54,"Pilot the barbell, Mazinji",1,0,1,0,,false
1594945386808049665,https://x.com/LandsharkRides/status/1594945386808049665,2022-11-22 06:46:27,Its cozy af,0,0,1,0,,false
1594946748895883265,https://x.com/LandsharkRides/status/1594946748895883265,2022-11-22 06:51:52,Was wondering where u were,1,0,3,0,,false
1594952394445844480,https://x.com/LandsharkRides/status/1594952394445844480,2022-11-22 07:14:18,Sending power,0,0,39,0,,false
1594966348664381442,https://x.com/LandsharkRides/status/1594966348664381442,2022-11-22 08:09:45,"There are retired world level chess players posting geopolitical analysis on facebook to 11 likes while local girls at every town average 500 per picture. That's an imbalance. <a href=""/search?q=%23HiddenAsymmetries"">#HiddenAsymmetries</a>",10,0,337,0,,false
1594976119702315010,https://x.com/LandsharkRides/status/1594976119702315010,2022-11-22 08:48:34,Look up Valery Salov interviews,2,0,3,0,,false
1594980001342013441,https://x.com/LandsharkRides/status/1594980001342013441,2022-11-22 09:04:00,Bought my girlfriend a lab-grown diamond ring but she said it's not the same because it's the suffering and violence behind the mineral that give it its value so I kidnnapped a minority guy and Korban'd him over the ring and she said oh ok it's fine now actually this works too,15,0,401,0,,false
1595024162372063234,https://x.com/LandsharkRides/status/1595024162372063234,2022-11-22 11:59:29,FIFA is scary because you watch your top homies turn into normies in front of your eyes. One moment a guy is posting about Assyrian religion and 16th century printmaking under a Loli_Himmler handle and next day he's watching the Argentina game at the bar. Im not even judging dawg,19,0,741,0,,false
1595025514439520257,https://x.com/LandsharkRides/status/1595025514439520257,2022-11-22 12:04:51,Football is coming home lads,2,0,172,0,,false
1595029406883389440,https://x.com/LandsharkRides/status/1595029406883389440,2022-11-22 12:20:19,Ur gym sucks unless it has a wall like this,2,0,168,0,https://pbs.twimg.com/media/FiKuyfhXgAERaUg.jpg,false
1595032203364339712,https://x.com/LandsharkRides/status/1595032203364339712,2022-11-22 12:31:26,Bulgarian Bulgarian,0,0,2,0,,false
1595035159849574400,https://x.com/LandsharkRides/status/1595035159849574400,2022-11-22 12:43:11,Good post from the RPF,3,0,61,0,https://pbs.twimg.com/media/FiK0A5sXkAICgs8.jpg;https://pbs.twimg.com/media/FiK0BG5X0AEzmA-.jpg;https://pbs.twimg.com/media/FiK0BXfXwAYCHrx.jpg;https://pbs.twimg.com/media/FiK0Bm9WYAAewy2.jpg,false
1595061184180457472,https://x.com/LandsharkRides/status/1595061184180457472,2022-11-22 14:26:35,,14,0,626,0,https://pbs.twimg.com/media/FiLLsYTXkAIULIu.jpg,false
1595072942697742336,https://x.com/LandsharkRides/status/1595072942697742336,2022-11-22 15:13:19,"I really want to get on one of those luxury 1950 airplane flights, where you get to have a gallon of tomato juice and smoked ham with turkey while smoking a cigar and experiencing the extreme altitude spiritual openness Evola mentioned. Must have been so comfy to travel that way.",5,0,149,0,,false
1595073631842979845,https://x.com/LandsharkRides/status/1595073631842979845,2022-11-22 15:16:03,Those are like 4 diff ones and no,1,0,2,0,,false
1595073742169858050,https://x.com/LandsharkRides/status/1595073742169858050,2022-11-22 15:16:29,Insane,0,0,4,0,,false
1595076736211116034,https://x.com/LandsharkRides/status/1595076736211116034,2022-11-22 15:28:23,Wow what an intelligent and curious femoid,7,0,253,0,,false
1595080257333522433,https://x.com/LandsharkRides/status/1595080257333522433,2022-11-22 15:42:23,Never talk cheese with rats...,8,0,260,0,,false
1595085212605628417,https://x.com/LandsharkRides/status/1595085212605628417,2022-11-22 16:02:04,CheeseShark,0,0,6,0,,false
1595085291555115009,https://x.com/LandsharkRides/status/1595085291555115009,2022-11-22 16:02:23,*shits himself*,1,0,4,0,,false
1595106879356948480,https://x.com/LandsharkRides/status/1595106879356948480,2022-11-22 17:28:10,"There's vanilla Haagen Dasz ice cream at the local supermarket that's insanely cheap, like 10x cheaper than it should be, I'm pretty sure it's the one they recalled in Western Europe because they found it gave people cancer. I just bought a ton of it for almost free. I always win",17,0,487,0,,false
1595107899302637568,https://x.com/LandsharkRides/status/1595107899302637568,2022-11-22 17:32:13,"(rural hick voice) City slickers scared of em cancer causing chemicals ice cream nowadays ... Back in them old days my nana put DDT by the spoon in our ice cream, kept them flies out, aint nothing happen to us kids. Cousin Johnny died of cancer but it's cause he smoked too much",2,0,187,0,,false
1595112773008363520,https://x.com/LandsharkRides/status/1595112773008363520,2022-11-22 17:51:35,"No that one was like 80% off to get rid of freezer space, here they just quietly lowered the prices for one specific kind only without any discount signs or anything",1,0,25,0,,false
1595117347538612225,https://x.com/LandsharkRides/status/1595117347538612225,2022-11-22 18:09:46,"""...""",0,0,0,0,,false
1595123851909681152,https://x.com/LandsharkRides/status/1595123851909681152,2022-11-22 18:35:36,,0,0,12,0,https://pbs.twimg.com/media/FiMEsGUXkAYMSkQ.jpg,false
1595131682914725888,https://x.com/LandsharkRides/status/1595131682914725888,2022-11-22 19:06:43,How I look at the cashier handing out my Mango Monster,7,0,170,0,https://pbs.twimg.com/media/FiMLzhwXwAc9p9f.jpg,false
1595132073378865153,https://x.com/LandsharkRides/status/1595132073378865153,2022-11-22 19:08:17,Can I like grow ephedra in a flower pot,11,0,66,0,,false
1595137163233853441,https://x.com/LandsharkRides/status/1595137163233853441,2022-11-22 19:28:30,"Idea: ""Enemiesgiving"", like Thanksgiving with your Enemies",23,0,294,0,,false
1595138477372604416,https://x.com/LandsharkRides/status/1595138477372604416,2022-11-22 19:33:43,"One celebrates the most intimate and blessed relation between men: that of enemyship, which offers opportunities in spiritual development unreachable through mere friendship. This is what Christianity is all about. A competition between true rivals in being the best guest or host",4,0,104,0,,false
1595138692313935872,https://x.com/LandsharkRides/status/1595138692313935872,2022-11-22 19:34:35,Just me and you then,1,0,1,0,,false
1595138785385549824,https://x.com/LandsharkRides/status/1595138785385549824,2022-11-22 19:34:57,Anyone standing against the Soylennials is an ally,1,0,23,0,,false
1595139652671123456,https://x.com/LandsharkRides/status/1595139652671123456,2022-11-22 19:38:24,"I do not recall but check <a href=""http://bionergetic.life"">bionergetic.life</a>",1,0,1,0,,false
1595140118628925440,https://x.com/LandsharkRides/status/1595140118628925440,2022-11-22 19:40:15,"""I can be""",1,0,1,0,,false
1595141040226594817,https://x.com/LandsharkRides/status/1595141040226594817,2022-11-22 19:43:54,"[Gilbert Chesterton voice] ""All religions celebrate friendship, because it is a natural thing to do so. But only Christianity celebrates enemyship, precisely because of how not natural that idea is. Christ tells us to pray for our enemies and help them in need. A pagan would ne-""",2,0,66,0,,false
1595141387091341312,https://x.com/LandsharkRides/status/1595141387091341312,2022-11-22 19:45:17,Okay,0,0,1,0,,false
1595144745122435072,https://x.com/LandsharkRides/status/1595144745122435072,2022-11-22 19:58:38,"I attribute the total disappearance of the ""I just want a girlfriend in whose lap to lie in and finally feel comfortable"" posts this year on me writing a brutally bitter tweet every time I saw one of them over the course of years. Desoyification almost complete.",5,0,221,0,,false
1595145425312702470,https://x.com/LandsharkRides/status/1595145425312702470,2022-11-22 20:01:20,"I plan to keep pushing the emotional intimacy Overton window further to the right until the only acceptable thoughts on the topic are ""I want to drink alone in my room"" or ""I want to work on a cargo ship near the north pole"".",7,0,173,0,,false
1595150119795830784,https://x.com/LandsharkRides/status/1595150119795830784,2022-11-22 20:19:59,No sorry....,1,0,1,0,,false
1595152527250452480,https://x.com/LandsharkRides/status/1595152527250452480,2022-11-22 20:29:33,"I read that a lot of Chinese restaurants sell one food for foreigners and then also have a second Chienese-only menu with dishes that white ppl wouldn't like, so I went to a Chinatown place and asked for the secret menu, but somehow ended up accidentally purchasing 5 kg of heroin",24,0,608,0,,false
1595153523271876608,https://x.com/LandsharkRides/status/1595153523271876608,2022-11-22 20:33:31,"A lot of it is like spicy chicken feet or offal, we eat that type of stuff here too tho tbh",1,0,14,0,,false
1595153735021256704,https://x.com/LandsharkRides/status/1595153735021256704,2022-11-22 20:34:21,,1,0,72,0,,true
1595155723209822209,https://x.com/LandsharkRides/status/1595155723209822209,2022-11-22 20:42:15,,0,0,59,0,,true
1595156139460931584,https://x.com/LandsharkRides/status/1595156139460931584,2022-11-22 20:43:54,"""Technically if we fight about it we trick the system and you get invited""",1,0,2,0,,false
1595156346940555264,https://x.com/LandsharkRides/status/1595156346940555264,2022-11-22 20:44:44,Never.....,1,0,1,0,,false
1595158733482766336,https://x.com/LandsharkRides/status/1595158733482766336,2022-11-22 20:54:13,"Even if your digestion is ok, if you have white tongue it means there is bacterial overgrowth and u should consider doing a week of camphoric acid (idealabs has it) and daily carrot salads to get it cleaned up, also reducing starches maybe. Pink healthy tongue essential attribute",25,0,470,0,,false
1595162360481992705,https://x.com/LandsharkRides/status/1595162360481992705,2022-11-22 21:08:38,"Hiding my girlfriend's Lab Grown Diamond wedding ring inside her Imitation Crab Meat sushi at the rebranded Donetsk People's Republic ""Don Mac"" fake McDonalds restaurant. A PMC Wagner priest is dispatched to the location to officiate the ceremony. He has no license to do it. 💔💔",4,0,132,0,,false
1595165889439334400,https://x.com/LandsharkRides/status/1595165889439334400,2022-11-22 21:22:39,"Christmas season truly the best time to enjoy fresh oranges, mandarins, pineapple slices (maybe with smoked ham over a very German ""toast Hawaii""?), even canned ones are good. Tropical fruit chocolates, just like coffee and hot cocoa, are always most delicious in wintertime imo.",14,0,118,0,,false
1595175505883500592,https://x.com/LandsharkRides/status/1595175505883500592,2022-11-22 22:00:52,In the 18th century you could live your entire life out without meeting even a single libtard altogether. Cannot contemplate this for long without tearing up a little bit.,14,0,612,0,,false
1595177356917968896,https://x.com/LandsharkRides/status/1595177356917968896,2022-11-22 22:08:13,Mixed,0,0,1,0,,false
1595177622446784512,https://x.com/LandsharkRides/status/1595177622446784512,2022-11-22 22:09:16,What was it on,0,0,2,0,,false
1595177904912355328,https://x.com/LandsharkRides/status/1595177904912355328,2022-11-22 22:10:24,I would try a very clean diet for a bit and maybe something like cyproheptadine,0,0,0,0,,false
1595178098768707587,https://x.com/LandsharkRides/status/1595178098768707587,2022-11-22 22:11:10,I guess just dietary restrictions,1,0,3,0,,false
1595178261981560835,https://x.com/LandsharkRides/status/1595178261981560835,2022-11-22 22:11:49,I guess ur already in good health so might as well just go for the fun stuff like 10-methoxy-harmalan and diamant,4,0,25,0,,false
1595178439761612801,https://x.com/LandsharkRides/status/1595178439761612801,2022-11-22 22:12:31,Just in the morning with water,1,0,5,0,,false
1595178489241559046,https://x.com/LandsharkRides/status/1595178489241559046,2022-11-22 22:12:43,No,0,0,4,0,,false
1595178630942003202,https://x.com/LandsharkRides/status/1595178630942003202,2022-11-22 22:13:17,Yeah,1,0,3,0,,false
1595183914938671110,https://x.com/LandsharkRides/status/1595183914938671110,2022-11-22 22:34:17,Starches is sufficient,1,0,2,0,,false
1595183965178036224,https://x.com/LandsharkRides/status/1595183965178036224,2022-11-22 22:34:29,You can reverse engineer it pretty easily,1,0,5,0,,false
1595184423712034818,https://x.com/LandsharkRides/status/1595184423712034818,2022-11-22 22:36:18,Last Freikorps member,0,0,1,0,,false
1595184663957573632,https://x.com/LandsharkRides/status/1595184663957573632,2022-11-22 22:37:15,What did old me say,0,0,11,0,,false
1595187095580049408,https://x.com/LandsharkRides/status/1595187095580049408,2022-11-22 22:46:55,Naw it's the one brand that doesn't have those here,1,0,1,0,,false
1595187393690304518,https://x.com/LandsharkRides/status/1595187393690304518,2022-11-22 22:48:06,"Fucked up but people can basically reverse engineer my stance on any topic with zero surprises, if you say too much you become an open book",12,0,258,0,,false
1595192837800353793,https://x.com/LandsharkRides/status/1595192837800353793,2022-11-22 23:09:44,"Going to make my own ""rebuild"" of Neon Genesis Evangelion, where Misato's exotic house pet is an anteater instead",7,0,171,0,,false
1595193400445538304,https://x.com/LandsharkRides/status/1595193400445538304,2022-11-22 23:11:58,"""Which one? There are multiple""",0,0,8,0,,false
1595194015997100032,https://x.com/LandsharkRides/status/1595194015997100032,2022-11-22 23:14:25,There can be a funny plotline where the (predominantly nocturnal) anteater wakes Shinji and Asuka up or enters the room during that one kissing scene. The anteater's method of eating by penetrating into ant hills will fit nicely w/ the show's hidden sexual and Freudian undertones,3,0,84,0,,false
1595197296924364801,https://x.com/LandsharkRides/status/1595197296924364801,2022-11-22 23:27:27,"If the ""Komm, Susser Tod"" song at the End of Evangelion had been named off a Beethoven piece, I would have said him biting a metal rod attached to his piano to circumvent deafness makes it like an 18th century Evangelion because he's sorta ""inside"" it, but it's by Bach instead...",2,0,55,0,,false
