id,url,time,text,replies,retweets,likes,views,media,has_quote
1592790126455029760,https://x.com/LandsharkRides/status/1592790126455029760,2022-11-16 08:02:13,"Bookmarked, thank you, brother",0,0,4,0,,false
1592806410626252801,https://x.com/LandsharkRides/status/1592806410626252801,2022-11-16 09:06:55,Gm,1,0,1,0,,false
1592807195468795905,https://x.com/LandsharkRides/status/1592807195468795905,2022-11-16 09:10:02,Just saw my buddy on the street so I charged him down and threw myself into his arms. A weaker man would die on the spot but he managed to hoist my weight in the air. This is why strength training matters. FUNCTIONAL strength training. This massage brought to you by Mark Rippetoe,5,0,299,0,,false
1592808547980832771,https://x.com/LandsharkRides/status/1592808547980832771,2022-11-16 09:15:25,I guess Leibniz,1,0,1,0,,false
1592830359124598784,https://x.com/LandsharkRides/status/1592830359124598784,2022-11-16 10:42:05,It's fascinating how baseball caps play the same role for Norwooding Millennials with hair loss as those white judge wigs did for syphilis guys in the 17th century,3,0,144,0,,false
1592830543770439680,https://x.com/LandsharkRides/status/1592830543770439680,2022-11-16 10:42:49,Have you noticed guys with hoodies in the gym never get injured? What's  that about...,33,0,328,0,,false
1592831700895412227,https://x.com/LandsharkRides/status/1592831700895412227,2022-11-16 10:47:25,"""Anti-Nemets is codeword for anti-white.""",0,0,84,0,,false
1592834515273412608,https://x.com/LandsharkRides/status/1592834515273412608,2022-11-16 10:58:36,He asked me to go help him carry some heavy shit later this afternoon fuuuuck,0,0,110,0,,false
1592897629922676737,https://x.com/LandsharkRides/status/1592897629922676737,2022-11-16 15:09:24,"Almost snapped my back carrying a fridge upstairs but my bro's dad gave me 100 bucks and a bottle of homebrew fruit brandy that I took a swig of in the name of his good health so we gucci, I'm thinking of a baking soda (CO2) hot bath to hit the spot a bit with some more brandy...",6,0,175,0,,false
1592897917719056384,https://x.com/LandsharkRides/status/1592897917719056384,2022-11-16 15:10:32,This construction worker shit easy,4,0,71,0,,false
1592898685851283457,https://x.com/LandsharkRides/status/1592898685851283457,2022-11-16 15:13:35,Eu sunt mexican,1,0,3,0,,false
1592899317320548353,https://x.com/LandsharkRides/status/1592899317320548353,2022-11-16 15:16:06,A cup but just found out i dont have any rn,0,0,3,0,,false
1592899730748891136,https://x.com/LandsharkRides/status/1592899730748891136,2022-11-16 15:17:45,"A girl from my uni almost crashed her car today because she was trying to wave at me instead of looking at the road, it's like the opposite of that hair commercial where a bunch of men die because they keep looking at a hot chick's hair. This is the power of being a <a href=""/search?q=%23MaleFeminist"">#MaleFeminist</a>",5,0,457,0,,false
1592899940921257984,https://x.com/LandsharkRides/status/1592899940921257984,2022-11-16 15:18:35,,3,0,136,0,https://pbs.twimg.com/media/FhseDdGWQAA40Nz.jpg,false
1592900625863704577,https://x.com/LandsharkRides/status/1592900625863704577,2022-11-16 15:21:18,"No we carried other shit too it took some time, obv. would have done it for free but it was impolite to refuse, it's more like a gift for us  lindy",0,0,4,0,,false
1592900719128215556,https://x.com/LandsharkRides/status/1592900719128215556,2022-11-16 15:21:40,Not suree bro.....what if she doesnt. Ill wait 10 years for a more sure sign....,2,0,55,0,,false
1592903575696736259,https://x.com/LandsharkRides/status/1592903575696736259,2022-11-16 15:33:01,"Genuinely beautiful, can't wait for winter to come here",2,0,18,0,,false
1592916593306370048,https://x.com/LandsharkRides/status/1592916593306370048,2022-11-16 16:24:45,"Just used my chicken light too for first time this year too because of this, forgot how cozy it was",0,0,2,0,,false
1592921413370847232,https://x.com/LandsharkRides/status/1592921413370847232,2022-11-16 16:43:54,This is my favorite video ever now btw,4,0,400,0,,true
1592925913683234816,https://x.com/LandsharkRides/status/1592925913683234816,2022-11-16 17:01:47,"""Those are some important aspects of it""",0,0,4,0,,false
1592926703940407297,https://x.com/LandsharkRides/status/1592926703940407297,2022-11-16 17:04:56,"Do you use it all day? I tend to do like five 20 min sessions through the day, feels best to me, more only if im eating a vit A source like liver pate",0,0,5,0,,false
1592931703215255554,https://x.com/LandsharkRides/status/1592931703215255554,2022-11-16 17:24:47,AAAAAAAAAAAAAH,0,0,20,0,,false
1592934590356000768,https://x.com/LandsharkRides/status/1592934590356000768,2022-11-16 17:36:16,"A lot of people, mostly men, are surprised when I tell them that I am a Male Feminist. They tend to see a contradiction between it and my macho looks, or my other stances like women being legal property of the Pater Familias. Just sad I still have to deal w/ this bigotry in 2023.",10,0,423,0,,false
1592937906867699712,https://x.com/LandsharkRides/status/1592937906867699712,2022-11-16 17:49:27,"Many men are already passionate about the topic of consent, but a Male Feminist always takes it a step further, knowing that a woman can NEVER consent. Only her FATHER can. That's most likely you, if she lives in your household. Carlsbad probably has an article on it. Look it up.",1,0,205,0,,false
1592938600592986112,https://x.com/LandsharkRides/status/1592938600592986112,2022-11-16 17:52:12,I think it's better done in relax time and not intraworkout but some everest climbers actually had success doing it iirc,1,0,1,0,,false
1592942791499268096,https://x.com/LandsharkRides/status/1592942791499268096,2022-11-16 18:08:51,"Why are normies so obsessed with this shit idea of keeping whatever they want to do secret, dawg.. Like what can others even do to fuck my plans up. Fall ill with a rare liver disease that I can't diagnose and come to the hospital on my exam day? Act serious bro",21,0,358,0,,true
1592944027787464704,https://x.com/LandsharkRides/status/1592944027787464704,2022-11-16 18:13:46,"Actually someone can just bust my skull in with a tire iron and that will do the trick . Didn't really consider the more basic options while writing the OP, sorta focused too much on the exotic ideas ngl",3,0,139,0,,false
1592946710917283841,https://x.com/LandsharkRides/status/1592946710917283841,2022-11-16 18:24:26,Best feeling in class is making the funniest joke of all time with a completely deadpan serious expression. Everyone else laughing like crazy and you act like you didn't mean to be funny. Only other person who can resist it and also keep a deadpan look is always a male professor.,4,0,331,0,,false
1592947687586168832,https://x.com/LandsharkRides/status/1592947687586168832,2022-11-16 18:28:18,"Like John Swartzwelder making insane remarks about Abraham Lincoln being an asshole or cardio reducing your lifespan like he's sayings something mundane and everyone going crazy at whatever he said. 9 yead olds should go to school armed and be allowed to drink. Wow, subtle humor.",0,0,100,0,,false
1592949124290449408,https://x.com/LandsharkRides/status/1592949124290449408,2022-11-16 18:34:01,"It's pretty simple. Humor sucks. Guys who try to be funny are spiritual women. Women are not funny. Thus the ""spiritual women"" funny guys are also not funny. Their unfunny jokes appeal to real women (who are not funny, as already established, and thus can't recognize good humor).",19,0,347,0,,true
1592949933434236929,https://x.com/LandsharkRides/status/1592949933434236929,2022-11-16 18:37:14,"Really as a man there is never a good reason to attempt at ""making a joke"". I haven't made a single one in over eight years now. Last one was a ""knock, knock"" type to celebrate my nephew's birth.",13,0,173,0,,false
1592950124266672128,https://x.com/LandsharkRides/status/1592950124266672128,2022-11-16 18:37:59,I have never been a big mushroom supplement guy ngl,1,0,6,0,,false
1592950369193463808,https://x.com/LandsharkRides/status/1592950369193463808,2022-11-16 18:38:58,Me,0,0,3,0,,false
1592951035668013057,https://x.com/LandsharkRides/status/1592951035668013057,2022-11-16 18:41:37,"""Divorce is already not an option. If your wife dies two days into the marriage you have to stay single for life now """,1,0,4,0,,false
1592955451347701760,https://x.com/LandsharkRides/status/1592955451347701760,2022-11-16 18:59:09,Knock knockc,1,0,8,0,,false
1592955983747162113,https://x.com/LandsharkRides/status/1592955983747162113,2022-11-16 19:01:16,Landshark,1,0,8,0,,false
1592956350652612610,https://x.com/LandsharkRides/status/1592956350652612610,2022-11-16 19:02:44,Landshark Rides,2,0,11,0,,false
1592956622204456960,https://x.com/LandsharkRides/status/1592956622204456960,2022-11-16 19:03:49,Hmmm,1,0,5,0,,false
1592957655605477376,https://x.com/LandsharkRides/status/1592957655605477376,2022-11-16 19:07:55,I'm not making a your mama joke on principle but remember that I could have done it if I wanted to,1,0,32,0,,false
1592965663240638465,https://x.com/LandsharkRides/status/1592965663240638465,2022-11-16 19:39:44,Serial killers are never on roids. Think about it...,18,0,313,0,,false
1592969216076189697,https://x.com/LandsharkRides/status/1592969216076189697,2022-11-16 19:53:51,"If I was like a psychopath guy who kidnaps women, I would probably do tren. I'm already reducing their life quality by ~98%, might as well give them smth pleasant to look at. ""It reduces your lifespan"" I'm getting caught in a few years anyways. They have satellites and shit now.",7,0,153,0,,false
1592978667113943040,https://x.com/LandsharkRides/status/1592978667113943040,2022-11-16 20:31:25,"One of the most brutal things to me are those American breakfast restaurants where you have unlimited black coffee refills so you can just sit drinking 20 cups of coffee in a row. John Swartzwelder would just go in the morning and work writing scripts for hours, drinking nonstop.",23,0,437,0,,false
1592980023581245440,https://x.com/LandsharkRides/status/1592980023581245440,2022-11-16 20:36:48,"I genuinely can see myself having like half a gallon of straight coffee daily there if it's good and I have a carb source on top of it to fuel off of. 2 hours twitter posting, 1 cup each 10 minutes average. 2 hours reading Rene Guenon, 1 cup per 5 minutes. 2 hours posting, bonus.",4,0,207,0,,false
1592982232914104320,https://x.com/LandsharkRides/status/1592982232914104320,2022-11-16 20:45:35,"Cannot stop thinking about Gene Wolfe saying us seeing space rockets as ""phallic"" is our delusion; and actually they represent the mechanical equivalent of an elongated single-cell microorganism. The things one sees under a microscope, if he looks at a drop of muddy gutter water.",5,0,184,0,,false
1592983277203501056,https://x.com/LandsharkRides/status/1592983277203501056,2022-11-16 20:49:44,"Another idea of his is that any intelligent life we could find in space would be us, man, again. Simply having forgotten we were there already. Like Greek sculptors seeing only themselves wherever they looked in nature or Europeans hearing Native American legends about white gods",3,0,99,0,,false
1592983410947284992,https://x.com/LandsharkRides/status/1592983410947284992,2022-11-16 20:50:16,"""This appears to be the original concept that his own idea refutes""",1,0,9,0,,false
1593004618652749824,https://x.com/LandsharkRides/status/1593004618652749824,2022-11-16 22:14:32,,2,0,187,0,https://pbs.twimg.com/media/Fht9QHuXEAATO1s.jpg,false
