id,url,time,text,replies,retweets,likes,views,media,has_quote
1616341888491220994,https://x.com/LandsharkRides/status/1616341888491220994,2023-01-20 07:48:31,"The above incident with the Japanese property seems to be just a factual and well documented thing that happened, e.g. he sold some to Paul Ziffren at like 3% of its actual price, it doesn't have to be more nefarious than just property fraud",0,0,5,184,,false
1616343985223602176,https://x.com/LandsharkRides/status/1616343985223602176,2023-01-20 07:56:50,Chud roast,0,0,6,541,,false
1616345667433021440,https://x.com/LandsharkRides/status/1616345667433021440,2023-01-20 08:03:32,Forgotten history but I'm pretty sure the colorful sunglasses thing was first a racist bodybuilder joke before tech workers discovered and adopted it too,0,0,9,377,,false
1616347899872288768,https://x.com/LandsharkRides/status/1616347899872288768,2023-01-20 08:12:24,Generally getting off it by gradually reducing the dose and trying something like Allopregnanolone probably is reasonable,0,0,4,214,,false
1616364239412940801,https://x.com/LandsharkRides/status/1616364239412940801,2023-01-20 09:17:19,"Like it's obvious the difference between a mafia member and a regular rural citizen is sorta a spectrum, but if you just lay waste to their compounds, narco villas, etc. the remnant members will cannibalize each other fighting for power anyways probably",3,0,266,9901,,false
1616364236501909505,https://x.com/LandsharkRides/status/1616364236501909505,2023-01-20 09:17:19,"People talking about Mexican cartels like the USA military wouldn't be able to fully unroot them in like a few weeks puzzle me. Like the peak of their military technology is a narco tank truck with steel plates, while the actual USA army has like heavy strategic stealth bombers.",62,0,695,38371,,false
1616379253355945985,https://x.com/LandsharkRides/status/1616379253355945985,2023-01-20 10:16:59,"I mean America can turn Afghanistan into glass if it wants to, there's just not much benefit to it",6,0,98,3513,,false
1616383758923436032,https://x.com/LandsharkRides/status/1616383758923436032,2023-01-20 10:34:53,"When you see those ""I went to America and it's le demonic capitalism"" gutter posts you can always be certain the poster already had a fully pre-conceived notion in his mind, probably had the post mentally typed out almost word for word, before he even went there to ""confirm"" it.",14,0,401,27773,,true
1616384477298626561,https://x.com/LandsharkRides/status/1616384477298626561,2023-01-20 10:37:45,"Similarly no one can be really impressed with Europe, I think people just go there to witness and ""confirm"" the romantic image they have already had built in their mind. The only interesting or stimulating places nowadays are off the map completely. You can Google Maps the rest.",12,0,230,11538,,false
1616436716348538885,https://x.com/LandsharkRides/status/1616436716348538885,2023-01-20 14:05:19,,3,0,184,9331,https://pbs.twimg.com/media/Fm68li2XEAYYHJA.jpg;https://pbs.twimg.com/media/Fm68nTrX0AAukY0.jpg,false
1616439351193346049,https://x.com/LandsharkRides/status/1616439351193346049,2023-01-20 14:15:47,"Alex Jones: water filter salesman
Prigozhin: vegetables salesman
MyPillow guy: pillow salesman
Haidut: hormonal supplement salesman

How deep does the rabbit hole go...",14,0,364,18412,,false
1616474501205696513,https://x.com/LandsharkRides/status/1616474501205696513,2023-01-20 16:35:28,The War of Anti-vaxxer Aggression,8,0,217,12676,,false
1616476842583531521,https://x.com/LandsharkRides/status/1616476842583531521,2023-01-20 16:44:46,"You can't even cheat in medschool because the professor's powerpoint slides disagree with the textbook, the same test question has different correct answers in different years, one question with the same ABCD options appears both as single-response and multiple response. Madness.",20,0,521,26543,,false
1616477527932796934,https://x.com/LandsharkRides/status/1616477527932796934,2023-01-20 16:47:30,"Like the same test question appears with the same response options in 2020, 2021, 2022 and every year the correct responses seems to change. Genuinely no idea who even is in control of doing this. Has to be some bizarre psychology  experiment by ZOG to give me mental breakdown..",8,0,307,11763,,false
1616478432132464654,https://x.com/LandsharkRides/status/1616478432132464654,2023-01-20 16:51:05,,3,0,203,7992,https://pbs.twimg.com/media/Fm7ikRQWAAA4aza.jpg,false
1616479508873216007,https://x.com/LandsharkRides/status/1616479508873216007,2023-01-20 16:55:22,I am like bottom 10%,0,0,13,188,,false
1616505087349690372,https://x.com/LandsharkRides/status/1616505087349690372,2023-01-20 18:37:00,"It's sorts like olive oil, mostly MUFA iirc, I like it with pancakes, you also asked me about it like 2 years ago",1,0,50,2529,,false
1616505264932327437,https://x.com/LandsharkRides/status/1616505264932327437,2023-01-20 18:37:43,"""...""",6,0,210,14886,,false
1616505790604447767,https://x.com/LandsharkRides/status/1616505790604447767,2023-01-20 18:39:48,Uhh it's also good on bread,1,0,34,1558,,false
1616507524655497220,https://x.com/LandsharkRides/status/1616507524655497220,2023-01-20 18:46:41,Just dont think about it it cant hurt us,1,0,12,760,,false
1616511551589998593,https://x.com/LandsharkRides/status/1616511551589998593,2023-01-20 19:02:41,"Generally when a peoples, race, species is pushed into the corner, with the only seeming possibilities as extinction or striking back brutally as a trapped spider, there is a secret third option, which consists in an absolutely radical adaptation, mutating into a whole new niche.",11,0,308,25830,,false
1616513652013600784,https://x.com/LandsharkRides/status/1616513652013600784,2023-01-20 19:11:02,"Examples: Yaghans, Nahanni tribe, ""Feather Tigers"" Chinese Gene Wolfe story, Phoenician Polynesians probably, snails, cave species, cryptids, Chernobyl asexual reproduction worms exposed to radiation, Neon Genesis Evangelion, aromorphosis concept",6,0,158,7987,,false
1616517715946078227,https://x.com/LandsharkRides/status/1616517715946078227,2023-01-20 19:27:11,Almost had to fight a gypsy today at a zogslop bakery waiting line because some skinny high school kid made fun of him taking too much time to buy shit and he was about to outchimp at him but his gypsy gf soothed him down and told him to just go. Longhouse race defense mechanism.,11,0,300,13500,,false
1616528643919855617,https://x.com/LandsharkRides/status/1616528643919855617,2023-01-20 20:10:37,Not rly but they have knives usually,0,0,24,617,,false
1616531690385539079,https://x.com/LandsharkRides/status/1616531690385539079,2023-01-20 20:22:43,"A white tank top should be called a ""girlfriendbeater"" unless you are married",14,0,519,21746,,false
1616532215403352065,https://x.com/LandsharkRides/status/1616532215403352065,2023-01-20 20:24:48,"Maybe ""husbandbeater"" and ""boyfriendbeater"" for the female ones too",5,0,139,9897,,false
1616532379723595778,https://x.com/LandsharkRides/status/1616532379723595778,2023-01-20 20:25:27,It's actually about chess and not physical fighting,1,0,9,439,,false
1616533383055638540,https://x.com/LandsharkRides/status/1616533383055638540,2023-01-20 20:29:26,"Eunuchs get a ""moneybeater"" (Gene Wolfe reference)",0,0,115,7816,,false
1616534580789448704,https://x.com/LandsharkRides/status/1616534580789448704,2023-01-20 20:34:12,"In France they call it a ""royale with cheese""",0,0,67,1534,,false
1616537141206548480,https://x.com/LandsharkRides/status/1616537141206548480,2023-01-20 20:44:22,In some prisons they jump in and out of cold showers to train for the feeling of getting stabbed with a knife because it's the same sensation,1,0,8,568,,false
1616538554330673152,https://x.com/LandsharkRides/status/1616538554330673152,2023-01-20 20:49:59,Swearing about being truecel under a lie detector,6,0,274,11508,,false
1616540649901228065,https://x.com/LandsharkRides/status/1616540649901228065,2023-01-20 20:58:19,,4,0,229,20160,https://pbs.twimg.com/media/Fm8bJhoXgBgxivS.jpg,true
1616543378522492946,https://x.com/LandsharkRides/status/1616543378522492946,2023-01-20 21:09:10,"""Put him in the Zorba Hypno machine...""",0,0,32,948,,false
1616546552842944516,https://x.com/LandsharkRides/status/1616546552842944516,2023-01-20 21:21:46,"ALCOHOL is the perfect pre-workout:

- Vasodilation for extreme pumps...

- Works as a painkiller, allowing you to go harder and grind out every single rep possible

- Worsens coordination, so your muscles work harder to balance the barbell, no need for a bamboo/earthquake bar...",60,0,1172,41211,,false
1616548386093649929,https://x.com/LandsharkRides/status/1616548386093649929,2023-01-20 21:29:03,I've told you this but when I was in highschool in like 2017 I saw your post about drinking beer while working out at a hotel gym at some anime con and tried to recreate it and almost puked on myself benching after a shitton of beer,4,0,144,3702,,false
1616552120420864001,https://x.com/LandsharkRides/status/1616552120420864001,2023-01-20 21:43:54,"None of the substances in the fake quote are real, it's just a bunch of funny nonsense words made to sound like smth real",2,0,22,561,,false
1616552403255410688,https://x.com/LandsharkRides/status/1616552403255410688,2023-01-20 21:45:01,"For more tips follow my IG page, AAbrah",2,0,266,11623,,false
1616567378581520384,https://x.com/LandsharkRides/status/1616567378581520384,2023-01-20 22:44:32,Bulgars and esp. boomers are pro russia but gov is zogged and just follows eu line,1,0,1,76,,false
1616583411434508289,https://x.com/LandsharkRides/status/1616583411434508289,2023-01-20 23:48:14,Ur friend probably heard it on some podcast if u have it with sugar and milk it's ok but if u need an actual substance to help probably pregnenolone,0,0,13,1580,,false
