id,url,time,text,replies,retweets,likes,views,media,has_quote
1629392960809836546,https://x.com/LandsharkRides/status/1629392960809836546,2023-02-25 08:08:49,Genuinely beautiful comment,0,0,2,614,,false
1629393219099275265,https://x.com/LandsharkRides/status/1629393219099275265,2023-02-25 08:09:50,know zero about it,0,0,1,78,,false
1629417814611116034,https://x.com/LandsharkRides/status/1629417814611116034,2023-02-25 09:47:34,I genuinely think I have the most objectively optimistic worldview in the world,9,0,194,8906,,false
1629426993925169153,https://x.com/LandsharkRides/status/1629426993925169153,2023-02-25 10:24:03,I believe eventually everything will be ok for everyone on all levels of life,1,0,26,508,,false
1629448174522834945,https://x.com/LandsharkRides/status/1629448174522834945,2023-02-25 11:48:13,Lets goooo,0,0,0,241,,false
1629448558758842368,https://x.com/LandsharkRides/status/1629448558758842368,2023-02-25 11:49:44,,6,0,476,13934,https://pbs.twimg.com/media/Fpz20y5WcAIdy9g.jpg,false
1629449853964099585,https://x.com/LandsharkRides/status/1629449853964099585,2023-02-25 11:54:53,"""You should not joke about this kind of stuff""",0,0,12,551,,false
1629450935062675456,https://x.com/LandsharkRides/status/1629450935062675456,2023-02-25 11:59:11,"Arthur Jones who was very possibly the highest testosterone man last century said he wanted his girlfriend to be intelligent so she could drive him around town. I'm telling you dawg girls are supposed to drive you, you're basically cucking yourself if you touch the steering wheel",25,0,340,18338,,false
1629452367216144384,https://x.com/LandsharkRides/status/1629452367216144384,2023-02-25 12:04:52,No one wants to take the final redpill that men are not meant to drive  and your girlfriend is supposed to drive you around town but both Tyler1 and Arthur Jones (both world historic visionaries) intuitively grasp the truth. It's only after a certain standpoint of ascent u see it,7,0,207,9320,,false
1629453776909221889,https://x.com/LandsharkRides/status/1629453776909221889,2023-02-25 12:10:28,Ur too big  u cant even get in car seat due to giant back how r u supposed to even be able to drive,0,0,9,997,,false
1629462338406342657,https://x.com/LandsharkRides/status/1629462338406342657,2023-02-25 12:44:30,"thats intended, low % lethal car crash chance at all times to keep it fun",0,0,20,1120,,false
1629465922879606784,https://x.com/LandsharkRides/status/1629465922879606784,2023-02-25 12:58:44,&gt;tfw no security clearance to military base library,5,0,119,6787,,false
1629519590551085058,https://x.com/LandsharkRides/status/1629519590551085058,2023-02-25 16:32:00,"Accepted 4000 follow requests, welcome to everyone joining the table for the first time or returning. I am a Bulgarian Medical Student and this is my account dedicated to the cell biology equivalent of being a flat earther and promoting Haitian white rum. I love all of you deeply",30,0,650,17118,,false
1629520693405577217,https://x.com/LandsharkRides/status/1629520693405577217,2023-02-25 16:36:22,"""Love and sodomic matters are actually incompatible""",0,0,26,852,,false
1629521136890396672,https://x.com/LandsharkRides/status/1629521136890396672,2023-02-25 16:38:08,There should ideally be a separate Smeedian anime incel high priority list but I am working with a primitive platform for now,1,0,6,361,,false
1629521320483471360,https://x.com/LandsharkRides/status/1629521320483471360,2023-02-25 16:38:52,"There are scripts but I prefer to click them manually as fast as possible as a workout, I sweat a lot by the end",0,0,14,592,,false
1629521788240633857,https://x.com/LandsharkRides/status/1629521788240633857,2023-02-25 16:40:44,"""I am an Eurasian bioidentical progesterone user""",0,0,11,460,,false
1629526296454656004,https://x.com/LandsharkRides/status/1629526296454656004,2023-02-25 16:58:38,MSH release?,1,0,1,74,,false
1629527067145433089,https://x.com/LandsharkRides/status/1629527067145433089,2023-02-25 17:01:42,"Thinking about how Askr and Embla, the equivalent of Adam and Eve in Northern folklore, were (according to one version of the story) made by the gods out of a ""dead tree and its equally dead parasite"", connecting the tale to the Biblical prophet Jonah and his tree with the worm.",4,0,61,8250,,false
1629527411304833024,https://x.com/LandsharkRides/status/1629527411304833024,2023-02-25 17:03:04,❤️❤️,0,0,2,758,,false
1629527538820104193,https://x.com/LandsharkRides/status/1629527538820104193,2023-02-25 17:03:35,,2,0,5,827,https://pbs.twimg.com/media/Fp0-p5EX0AMTmgg.png,false
1629527642511736834,https://x.com/LandsharkRides/status/1629527642511736834,2023-02-25 17:03:59,"I think anything else is ""below"" twitter",0,0,3,124,,false
1629528632484933640,https://x.com/LandsharkRides/status/1629528632484933640,2023-02-25 17:07:55,"People try to counter-signal this by pointing out that women tend to drive dangerously, but that's the entire point. The lethal danger makes it fun, you're ""aware"". Dying together with a cute girl by her driving into a tree at 90 mph is one of the most romantic things imaginable.",6,0,142,6037,,false
1629528794733092865,https://x.com/LandsharkRides/status/1629528794733092865,2023-02-25 17:08:34,Technically you can give her a tiny amount of DHT too without any side effects..,0,0,2,553,,false
1629535871794814977,https://x.com/LandsharkRides/status/1629535871794814977,2023-02-25 17:36:41,"Parasitism itself as a relation between organisms is a product of the Fall, so that makes it obvious the myth is not meant to be ""creationist"", but represents a ""restoration"" of the golden age by transmuting the Fall's products into something of Eden too",0,0,44,4335,,false
1629536257826070530,https://x.com/LandsharkRides/status/1629536257826070530,2023-02-25 17:38:13,There is a Bulgarian joke like that I read as a kid and found very vulgar,0,0,7,1159,,false
1629537389898022912,https://x.com/LandsharkRides/status/1629537389898022912,2023-02-25 17:42:43,The traffic is objectively pretty scary to be honest....,0,0,1,222,,false
1629538606300684288,https://x.com/LandsharkRides/status/1629538606300684288,2023-02-25 17:47:33,"From Gene Wolfe's dictionary, the horny chapter",3,0,75,8974,https://pbs.twimg.com/media/Fp1Io4bXoAAOCeT.png,false
1629539297052205059,https://x.com/LandsharkRides/status/1629539297052205059,2023-02-25 17:50:18,He used to literally read obscure old dictionaries for fun for days,0,0,12,359,,false
1629539889615101953,https://x.com/LandsharkRides/status/1629539889615101953,2023-02-25 17:52:39,Everyone who can enjoy my points ends up here one way or the other,0,0,12,388,,false
1629544204455104515,https://x.com/LandsharkRides/status/1629544204455104515,2023-02-25 18:09:48,"I think it doesn't matter much because you're going to end up working it for the rest of your life, so if it's 50 years or 60 makes little difference. Medschool is probably a lot less stressful if you're older",0,0,5,473,,false
1629550956974166016,https://x.com/LandsharkRides/status/1629550956974166016,2023-02-25 18:36:38,"Looking at the Wikipedia Talk page of a 1600s Japanese ethics book and the users are wondering why it has the biohazard warning symbol on its cover. This is one of those things that seems a fun coincidence, but if you keep pulling at the thread you end insane at a mental hospital",10,0,149,12042,,false
1629551962239770624,https://x.com/LandsharkRides/status/1629551962239770624,2023-02-25 18:40:38,"""Wikipedian"" does not have the same ring to it as ""redditor"" (popularized as an insult by a good friend of mine!), but a lot of the distasteful developments that early reddit takes the blame for actually started on Wikipedia behind closed doors and only later infected reddit too.",4,0,86,5193,,false
1629552012604973059,https://x.com/LandsharkRides/status/1629552012604973059,2023-02-25 18:40:50,Hagakure,0,0,4,258,,false
1629557798366322692,https://x.com/LandsharkRides/status/1629557798366322692,2023-02-25 19:03:49,imagine if it melts lmfao,3,0,9,1758,,false
1629563523821977603,https://x.com/LandsharkRides/status/1629563523821977603,2023-02-25 19:26:34,"Smtimes I've left the gym mid workout to get one more redbull off the corner store, can also send a gym zoomer on a quest to bring me one",2,0,14,1666,,false
1629565243851415562,https://x.com/LandsharkRides/status/1629565243851415562,2023-02-25 19:33:24,I absolutely love reading sovereign citizen stuff lol,0,0,0,182,,false
1629565490845679616,https://x.com/LandsharkRides/status/1629565490845679616,2023-02-25 19:34:23,"Sovereign citizen content is genuinely next level, this is what all  posting should look like",12,0,170,15666,,true
1629567695044726787,https://x.com/LandsharkRides/status/1629567695044726787,2023-02-25 19:43:09,"1854 Baxter Fletcher vs. The State of Arizona obscure lawsuit over right of free travel law, you're registered as a corporation on birth, federal land, illegal naval court flag cannot be used on civilian trials, etc. it's genuinely like a 200 IQ circuit court lawyer went haywire",1,0,82,4839,,false
1629568318511149056,https://x.com/LandsharkRides/status/1629568318511149056,2023-02-25 19:45:37,,1,0,7,736,https://pbs.twimg.com/media/Fp1jvpRXoAMLYW-.png,false
1629575715833167874,https://x.com/LandsharkRides/status/1629575715833167874,2023-02-25 20:15:01,I do! Welcome back bro,0,0,2,283,,false
1629577606214348803,https://x.com/LandsharkRides/status/1629577606214348803,2023-02-25 20:22:32,"""You can be redeemed no matter waht if you cultivate a strong enough devotion for Trump""",0,0,1,245,,false
1629578979945459712,https://x.com/LandsharkRides/status/1629578979945459712,2023-02-25 20:27:59,Total Victory imminent,0,0,52,1860,,false
1629608433283395587,https://x.com/LandsharkRides/status/1629608433283395587,2023-02-25 22:25:01,"Mine too actually, maybe like a 1% chance conservatively we meet there one day",0,0,2,117,,false
1629608850105008129,https://x.com/LandsharkRides/status/1629608850105008129,2023-02-25 22:26:41,bro u have to post pics afterwards,0,0,3,1229,,false
1629612278822715393,https://x.com/LandsharkRides/status/1629612278822715393,2023-02-25 22:40:18,I throw my flips flop off and everyone loses their minds,1,0,10,1796,,false
