id,url,time,text,replies,retweets,likes,views,media,has_quote
1654000123674865666,https://x.com/LandsharkRides/status/1654000123674865666,2023-05-04 05:48:53,Really explains itself,0,0,5,136,,false
1654000560142536722,https://x.com/LandsharkRides/status/1654000560142536722,2023-05-04 05:50:38,Pretty sure is more pro thyroid,0,0,3,577,,false
1654001036665712640,https://x.com/LandsharkRides/status/1654001036665712640,2023-05-04 05:52:31,"Jeb Bush is the most competent man in their family, people underestimate him because he's bad on stage",1,0,26,2175,,false
1654003782311657473,https://x.com/LandsharkRides/status/1654003782311657473,2023-05-04 06:03:26,Mogged,1,0,1,186,,false
1654034401066360833,https://x.com/LandsharkRides/status/1654034401066360833,2023-05-04 08:05:06,"Riding in a well-heated car through a rainstorm is so comfy because it's the purest distilled essence of the cold-wet versus hot-dry elemental dichotomy. It also is when a car is more of a house than a horse, because its primary function turns to shelter instead of locomotion.",12,0,428,14131,,false
1654035757223247875,https://x.com/LandsharkRides/status/1654035757223247875,2023-05-04 08:10:29,"Thinking of that /x/ greentext about how when storms hit at certain US highways the truckers have to pull off to the side and wait it out because the winds get too powerful so they just banter on their CB radio channel or take naps, cozy lifestyle",2,0,151,4039,,false
1654067025864454145,https://x.com/LandsharkRides/status/1654067025864454145,2023-05-04 10:14:44,It's insane how you always have a safe place to sleep no matter what when you have a car,0,0,3,84,,false
1654067740934643714,https://x.com/LandsharkRides/status/1654067740934643714,2023-05-04 10:17:35,Someone sending you a drunk message is always like the nicest thing of all time,8,0,363,10807,,false
1654070952118874114,https://x.com/LandsharkRides/status/1654070952118874114,2023-05-04 10:30:20,Foids.... Do you want to be the queen bee or the worker bee.... Think about it..,4,0,180,13881,,true
1654071989345173506,https://x.com/LandsharkRides/status/1654071989345173506,2023-05-04 10:34:28,Happens to the best of us,0,0,15,215,,false
1654121217836851200,https://x.com/LandsharkRides/status/1654121217836851200,2023-05-04 13:50:05,Should be still limited but ten times better than pufa,0,0,4,233,,false
1654151536849702913,https://x.com/LandsharkRides/status/1654151536849702913,2023-05-04 15:50:33,You mean 50% of your one rep max or 50% of your six rep max,1,0,3,67,,false
1654151603950067715,https://x.com/LandsharkRides/status/1654151603950067715,2023-05-04 15:50:49,"Childhood is when you idolize Caesar's legion....

Adult is when you realize Mr. House was right..",22,0,339,17479,,false
1654152540773072897,https://x.com/LandsharkRides/status/1654152540773072897,2023-05-04 15:54:33,First is crazy,1,0,10,953,,false
1654174510323466246,https://x.com/LandsharkRides/status/1654174510323466246,2023-05-04 17:21:50,,1,0,103,3936,https://pbs.twimg.com/media/FvTO0ZjWAA8uTyB.jpg,false
1654175562892443680,https://x.com/LandsharkRides/status/1654175562892443680,2023-05-04 17:26:01,Bro I am a medical student why the fuck do I have to take a class on semiconductors am I going to be treating army cyborgs or something,23,0,513,16503,,false
1654175817365061646,https://x.com/LandsharkRides/status/1654175817365061646,2023-05-04 17:27:02,"""Technically Serrano says the Vedic god is an incarnation of Hitler""",0,0,2,217,,false
1654176674655633416,https://x.com/LandsharkRides/status/1654176674655633416,2023-05-04 17:30:27,Didn't they use to make those in factories by literally using astrology,1,0,158,5512,,false
1654177592767807505,https://x.com/LandsharkRides/status/1654177592767807505,2023-05-04 17:34:05,I tried to propose replacing the ambulances with a horse carriage but they shot my suggestion down,1,0,56,1045,,false
1654178509718159365,https://x.com/LandsharkRides/status/1654178509718159365,2023-05-04 17:37:44,ZOG told Musk to turn the Chud filter back on for a few days,2,0,17,959,,false
1654179353977077780,https://x.com/LandsharkRides/status/1654179353977077780,2023-05-04 17:41:05,AI art pics are like meth to crypto guys kek,2,0,130,6274,,false
1654179541743484934,https://x.com/LandsharkRides/status/1654179541743484934,2023-05-04 17:41:50,Ngl if I am ever homeless I will lean deep into it for the vibe,0,0,1,83,,false
1654181858500812801,https://x.com/LandsharkRides/status/1654181858500812801,2023-05-04 17:51:02,Who the fuck is jack kruse dawg,2,0,21,835,,false
1654192030942220303,https://x.com/LandsharkRides/status/1654192030942220303,2023-05-04 18:31:28,The poster or the Chinese guy,1,0,1,177,,false
1654192354419527682,https://x.com/LandsharkRides/status/1654192354419527682,2023-05-04 18:32:45,Nvm,0,0,2,153,,false
1654198782051991552,https://x.com/LandsharkRides/status/1654198782051991552,2023-05-04 18:58:17,"Theory: The Athenian owl-like: ""Eja!, Eja!, Alala!"" war-cry resurrected by D'Annunzio in Fiume has the same etymology as Hebrew's ""Hallelujah"" and also is the source of the American native ""hand-over-mouth"" ululating battle cry (but ""Hoka-Hey"" means ""Let's goooooo"" in Lakotian).",7,0,107,6677,,false
1654200998997512198,https://x.com/LandsharkRides/status/1654200998997512198,2023-05-04 19:07:06,Slavic Andrew Tate,17,0,356,11271,https://pbs.twimg.com/media/FvTnCo_X0BkK6I0.jpg,false
1654208782795194370,https://x.com/LandsharkRides/status/1654208782795194370,2023-05-04 19:38:02,Theres one guy on RPF who recovered his dog's health by giving it a little bit daily,0,0,1,55,,false
1654215500753149956,https://x.com/LandsharkRides/status/1654215500753149956,2023-05-04 20:04:43,"Being a leftist is such an uphill battle because no matter how much you control ""culture"", media, education, morality, etc., ""normies"" immediately still return to their natural default of cheering for the deaths of ""asocial"" homeless people at the first opportunity that they get.",5,0,529,19592,,false
1654216613116215305,https://x.com/LandsharkRides/status/1654216613116215305,2023-05-04 20:09:09,"One incident and it all goes down the drain. It's like how a circus animal sometimes randomly snaps at a sudden noise and mauls its lion tamer. Unless 99.5% of the population is locked in the labor camps, what is called ""fascism"" by leftists appears again and again spontaneously.",3,0,301,7637,,false
1654217810313203714,https://x.com/LandsharkRides/status/1654217810313203714,2023-05-04 20:13:54,In a few decades medicine will solve the problems of drug addiction and mental illness and everyone will be able to function normally without cruelty,2,0,15,1043,,false
1654219545492729856,https://x.com/LandsharkRides/status/1654219545492729856,2023-05-04 20:20:48,"In a few decades the medical sector will be able to handle drug addiction, mental illnesses, violence, etc. in a non-lobotomic way, which ensures everyone will be able to function normally with help. Where economics and sociology fails, science succeeds. Faucianism lies forwards.",3,0,191,5237,,false
1654220445632331776,https://x.com/LandsharkRides/status/1654220445632331776,2023-05-04 20:24:22,Actually going to do it tomorrow,2,0,15,1346,,false
1654222033662668801,https://x.com/LandsharkRides/status/1654222033662668801,2023-05-04 20:30:41,Coeur Brah tanning his nuts,1,0,8,1078,,false
1654222474756718592,https://x.com/LandsharkRides/status/1654222474756718592,2023-05-04 20:32:26,Mwah,0,0,6,230,,false
1654227813313187841,https://x.com/LandsharkRides/status/1654227813313187841,2023-05-04 20:53:39,"No, no, I am talking about the other people on the train, twitter is an inherently political platform, people cheering are all right-wing. But as I said I believe this type of problem will eventually be a thing of the past similar to mass tuberculosis, deaths in childbirth, etc.",2,0,12,733,,false
1654228007513640960,https://x.com/LandsharkRides/status/1654228007513640960,2023-05-04 20:54:25,No I try to be sincere when it comes to this type of stuff even if I word it a bit loose,0,0,1,95,,false
1654228457818038273,https://x.com/LandsharkRides/status/1654228457818038273,2023-05-04 20:56:13,He didn't need subway surfers footage,0,0,2,116,,false
1654229452522389505,https://x.com/LandsharkRides/status/1654229452522389505,2023-05-04 21:00:10,Have you watched the Yuri Vlasov documentary? You would enjoy it I think,1,0,1,846,,false
1654237407695314944,https://x.com/LandsharkRides/status/1654237407695314944,2023-05-04 21:31:46,"John Swartzwelder is the funniest writer to me because a lot of his jokes are just interesting concepts like ""what if a druggist was able to marry people who fell in love in his store"" or like property owners lobbying writers to stage stories on their land to get more visitors in",0,0,63,5455,,false
1654237547978014720,https://x.com/LandsharkRides/status/1654237547978014720,2023-05-04 21:32:20,They look so focused lol,0,0,3,654,,false
1654243222279933953,https://x.com/LandsharkRides/status/1654243222279933953,2023-05-04 21:54:53,Have you read Steve Justa's isometrics book? He had some very impressive strength feats,1,0,2,1047,,false
