id,url,time,text,replies,retweets,likes,views,media,has_quote
1688465818743341056,https://x.com/LandsharkRides/status/1688465818743341056,2023-08-07 08:23:16,eat steak every night mayb,0,0,2,123,,false
1688465962633158657,https://x.com/LandsharkRides/status/1688465962633158657,2023-08-07 08:23:50,thyroid probably,0,0,1,176,,false
1688466570262024192,https://x.com/LandsharkRides/status/1688466570262024192,2023-08-07 08:26:15,dunno whjatever local cheap one u have,0,0,0,41,,false
1688466633428246529,https://x.com/LandsharkRides/status/1688466633428246529,2023-08-07 08:26:30,sorry,1,0,1,152,,false
1688469099548909568,https://x.com/LandsharkRides/status/1688469099548909568,2023-08-07 08:36:18,,12,0,338,14707,https://pbs.twimg.com/media/F26lshrWEAAVGwv.png,false
1688483084260245504,https://x.com/LandsharkRides/status/1688483084260245504,2023-08-07 09:31:52,"""The nobility must awaken, or else resign itself to perish, and not even gloriously: to perish by corrosion and fatal submersion. To awaken — that means: to become once more, *at any cost*, a political class.""",3,0,181,13007,https://pbs.twimg.com/media/F26yJ-7W0AAnZCk.jpg,true
1688485994671022080,https://x.com/LandsharkRides/status/1688485994671022080,2023-08-07 09:43:26,"""We could understand a nobility which represents a political opposition, which sought to maintain consistency with its proper traditions — violently reactionary, conservative and legitimist, as was the case to a certain extent with a specific German aristocracy."" -from same essay",2,0,66,4331,,false
1688502748566650880,https://x.com/LandsharkRides/status/1688502748566650880,2023-08-07 10:50:00,w-whjat is this supposed to mean 😭😭,0,0,32,929,,false
1688507684595609600,https://x.com/LandsharkRides/status/1688507684595609600,2023-08-07 11:09:37,"I've posted about this before, but John Graunt, the literal inventor of epidemiology and demographics as sciences, was highly skeptical of the reported numbers for bubonic plague deaths and claimed the corpse collectors/coroners were misinterpreting the cause of death of the dead",3,0,160,7046,,false
1688508165028036608,https://x.com/LandsharkRides/status/1688508165028036608,2023-08-07 11:11:32,"The book was ""Natural and Political Observations Made upon the Bills of Mortality"" published in 1662 and he basically speculated that they had reclassified the deaths from liver inflammation, ""spleen"", etc. and rebranded them as plague deaths to push up the numbers. Same as 2020.",2,0,91,4799,,false
1688508662388539392,https://x.com/LandsharkRides/status/1688508662388539392,2023-08-07 11:13:30,The father of antivaxxers and covid skeptics,0,0,100,4763,https://pbs.twimg.com/media/F27Jka1XIAA6kSE.png,false
1688526303782146048,https://x.com/LandsharkRides/status/1688526303782146048,2023-08-07 12:23:36,"A few excerpts from Captain John Graunt's book's Index:

- ""The troublesome seclusions in the Plague-time are not a remedy to be purchased at vast inconveniences.""

- ""Alterations in the Air do incomparably more operate as to the Plague, than the Contagion of Converse.""",1,0,31,4684,,false
1688526305854132224,https://x.com/LandsharkRides/status/1688526305854132224,2023-08-07 12:23:37,"- ""Purples, Small-Pox, and other malignant Diseases, fore-run the Plague.""

- ""The more sickly the year is, the less fertile of Births.""

- ""In London there have been 12 Burials for 11 Christnings.""

- ""in the Country there have been, contrariwise, 63 Christnings for 52 Burials.""",1,0,21,3913,,false
1688527279226224641,https://x.com/LandsharkRides/status/1688527279226224641,2023-08-07 12:27:29,His basic observations are that no one understands how the plague or disease in general works and nothing done about them influences their cyclical patterns whatsoever. And that people multiply in the country and then move to the big city en masse and die out there. 17th century.,0,0,29,3457,,false
1688537641598214144,https://x.com/LandsharkRides/status/1688537641598214144,2023-08-07 13:08:39,"John Graunt doubts the diagnoses of ""death of old age"" and says they are probably matter of subjective judgement of the coroners, even if in old age there was a loss of ""Innate Heat"" (metabolic decline). Dr. Hans Selye also didn't believe in deaths of old age, always a real cause",2,0,77,6357,,false
1688539173005692928,https://x.com/LandsharkRides/status/1688539173005692928,2023-08-07 13:14:45,"Dr. Ray Peat liked to mention how some Northern European clinics still put ""low Vitamin D level"" as a cause of death in respiratory illnesses and how ""inflammation of the colon"" was a very common cause of death in the 19th century. ""Died in sleep of old age"" = DHEA insufficiency.",2,0,59,4778,,false
1688539888973500416,https://x.com/LandsharkRides/status/1688539888973500416,2023-08-07 13:17:35,"More fuel for the ""all Navies are psychopathic and constantly trying to start an all-out war to the horror of their respective civil governments"" theory",8,0,248,13099,,true
1688540481041358848,https://x.com/LandsharkRides/status/1688540481041358848,2023-08-07 13:19:56,,1,0,73,4639,https://pbs.twimg.com/media/F27mnhkWIAIznzx.png,false
1688543048970469376,https://x.com/LandsharkRides/status/1688543048970469376,2023-08-07 13:30:09,"1600s English medics seem to have (correctly) believed that the ""Headach"" disease was actually in the stomach instead of the brain, where it hurt. Endotoxin-Estrogen. Explains how they knew to use laxatives, emetics, etc. to cure this type of stuff by keeping the intestine clean.",2,0,140,7653,,false
1688582925128785920,https://x.com/LandsharkRides/status/1688582925128785920,2023-08-07 16:08:36,"""Girl with Curls"", very early Salvador Dali, 1926.",17,0,300,14364,https://pbs.twimg.com/media/F28M1gIWkAAW5vH.jpg,false
1688587998110052352,https://x.com/LandsharkRides/status/1688587998110052352,2023-08-07 16:28:45,"""From the stone-like precipitance of Lucifer, the upward rectification begins, and the stone, which is concretion and fall, becomes the necessary base for the flight towards elemental complexity and trans-elemental totality."" - Havismat

Morning Ossification of the Cypress, Dali.",1,0,47,5826,https://pbs.twimg.com/media/F28R0lrWEAA0_sB.jpg,false
1688591903091036160,https://x.com/LandsharkRides/status/1688591903091036160,2023-08-07 16:44:16,"""rural chud whisperer""",4,0,107,3973,,false
1688591971776970756,https://x.com/LandsharkRides/status/1688591971776970756,2023-08-07 16:44:33,genuinely lolling at it,0,0,16,505,,false
1688596586148904983,https://x.com/LandsharkRides/status/1688596586148904983,2023-08-07 17:02:53,lmao,0,0,0,296,,false
1688596787957841925,https://x.com/LandsharkRides/status/1688596787957841925,2023-08-07 17:03:41,"""Do you want me to say the line...""",1,0,1,51,,false
1688599204401188868,https://x.com/LandsharkRides/status/1688599204401188868,2023-08-07 17:13:17,"Traditional remedy for children unable to sleep here was wine porridge, my uncle also got wine as a baby to sleep better, good times",1,0,16,1440,,false
1688604931685531650,https://x.com/LandsharkRides/status/1688604931685531650,2023-08-07 17:36:03,"""Don't worry about it babe""",1,0,1,51,,false
1688607473651826688,https://x.com/LandsharkRides/status/1688607473651826688,2023-08-07 17:46:09,"Next to Agmatine (which is actually a Nitric Oxide inhibitor, contrary to how they market it to peddle to normies), another secret Dr. Ray Peat approved bodybuilding supplement is hydroxymethylbutyrate, which is metabolized into cholesterol in the muscles. Good way to increase it",1,0,111,9055,,false
1688612514450362368,https://x.com/LandsharkRides/status/1688612514450362368,2023-08-07 18:06:11,"People always ask me for supp recommendations so here it goes: Agmatine for good mood during workouts, HMB for an extra inch of gains and good health in general. Just make sure whatever you buy has no Titanium Dioxide or Silicon in the excipients. Agmatine and HMB. Bookmark this.",6,0,101,7138,,false
1688625375788535808,https://x.com/LandsharkRides/status/1688625375788535808,2023-08-07 18:57:17,Peatleg.....,0,0,4,79,,false
1688637447905697794,https://x.com/LandsharkRides/status/1688637447905697794,2023-08-07 19:45:15,Roided out bodybuilder who is really into Clarice Lispector,6,0,81,6003,,false
1688637883979120641,https://x.com/LandsharkRides/status/1688637883979120641,2023-08-07 19:46:59,"Maybe named something like ""<a href=""/LISPECTOR_GAINS"" title=""Lispectorcel"">@LISPECTOR_GAINS</a>""",1,0,38,3860,,false
1688639439524773888,https://x.com/LandsharkRides/status/1688639439524773888,2023-08-07 19:53:10,Waking up with a mysterious large scar is always exciting. Like damn I really fucked some demonic type entity up last night huh. Decked it in its demon teeth too,7,0,213,8364,,false
1688639518612594688,https://x.com/LandsharkRides/status/1688639518612594688,2023-08-07 19:53:29,i litereally have POSTITVE canthal tilt,0,0,5,141,,false
1688650732797296640,https://x.com/LandsharkRides/status/1688650732797296640,2023-08-07 20:38:02,Accidentally found out Capsaicin apparently inhibits Aspirin oral availability recently,1,0,26,2605,,false
1688652031773274113,https://x.com/LandsharkRides/status/1688652031773274113,2023-08-07 20:43:12,,17,0,602,15271,https://pbs.twimg.com/media/F29MEgfWAAIxO7T.jpg,false
