id,url,time,text,replies,retweets,likes,views,media,has_quote
1711225761909383299,https://x.com/xenocosmography/status/1711225761909383299,2023-10-09 03:43:09,"""... to the extent that we ever find out the truth about any of this, it will be because of Elon Musk, without whom we’d only have access to state-approved propaganda."" <a href=""https://www.tabletmag.com/sections/israel-middle-east/articles/americas-betrayal-of-israel"">tabletmag.com/sections/israe…</a>",1,3,27,2149,,false
1711227901168034094,https://x.com/xenocosmography/status/1711227901168034094,2023-10-09 03:51:39,Dearly as I love Alex Jones ...,1,0,1,198,,false
1711231344871915930,https://x.com/xenocosmography/status/1711231344871915930,2023-10-09 04:05:20,He's tripled down into insane trolling. Doubt there's much point trying to follow him into the clown house with an argument.,0,0,13,595,,false
1711236610988400888,https://x.com/xenocosmography/status/1711236610988400888,2023-10-09 04:26:15,"Ironically, think Richard might be remembered as the guy who disproved the infinite monkey theorem.",1,0,4,395,,false
1711237666703098313,https://x.com/xenocosmography/status/1711237666703098313,2023-10-09 04:30:27,"... The monkeys are doing great, until at a certain critical point they begin to think they're writing Shakespearean English and flame out against the cringe barrier.",0,0,3,84,,false
1711246073665036308,https://x.com/xenocosmography/status/1711246073665036308,2023-10-09 05:03:52,Not sure I've ever seen an invocation of Nemesis quite this intense.,1,0,4,231,,false
1711247351762112993,https://x.com/xenocosmography/status/1711247351762112993,2023-10-09 05:08:56,"Absolute divergence in prognosis, but perfect convergence of prescription. Ironic alliance material. <a href=""https://zer0h0urs.wordpress.com/2023/08/05/marx-the-first-anarcho-capitalist/"">zer0h0urs.wordpress.com/2023…</a>",4,3,25,2251,,false
1711247840574583051,https://x.com/xenocosmography/status/1711247840574583051,2023-10-09 05:10:53,"... ""Do capitalism harder and see where we end up.""",2,0,14,1079,,false
1711248441920368811,https://x.com/xenocosmography/status/1711248441920368811,2023-10-09 05:13:16,"... Impossible to take exception at this. <a href=""https://zer0h0urs.wordpress.com/2023/06/19/libertarians-and-communists-need-a-grand-coalition-to-downsize-washington/"">zer0h0urs.wordpress.com/2023…</a>",0,0,9,899,,false
1711254329385185725,https://x.com/xenocosmography/status/1711254329385185725,2023-10-09 05:36:40,Finding it hard to keep up. What's the difference between a cis heterosexual male and a trans lesbian again?,17,3,47,5502,,true
1711255869944738028,https://x.com/xenocosmography/status/1711255869944738028,2023-10-09 05:42:47,"Do they just lack a UN-backed sense of ambition, though?",1,0,3,300,,false
1711256402549973319,https://x.com/xenocosmography/status/1711256402549973319,2023-10-09 05:44:54,'Autogynophilia' is when lesbians are bigoted for not sleeping with you?,0,0,4,315,,false
1711259322507026450,https://x.com/xenocosmography/status/1711259322507026450,2023-10-09 05:56:30,You're saying there are testable criteria for gender self-identification? Doesn't sound very 2023 left-liberal.,1,0,3,394,,false
1711259603307311519,https://x.com/xenocosmography/status/1711259603307311519,2023-10-09 05:57:37,So much unapologetic misgendering going on in this tweet.,0,0,4,402,,false
1711260572569006124,https://x.com/xenocosmography/status/1711260572569006124,2023-10-09 06:01:28,A 'trans lesbian' is a smart cis heterosexual male facing a prison sentence.,3,7,81,36016,,false
1711263897943241160,https://x.com/xenocosmography/status/1711263897943241160,2023-10-09 06:14:41,"The objectively best writer is an Englishman from the Sixteenth Century. Best five, probably.",8,3,78,4126,,false
1711264353234878613,https://x.com/xenocosmography/status/1711264353234878613,2023-10-09 06:16:30,"... Sixteenth and Seventeenth Centuries, to be sure.",3,0,24,1450,,false
1711270816850264305,https://x.com/xenocosmography/status/1711270816850264305,2023-10-09 06:42:11,Genius of the trans lesbian ID is it offers a get-out card from the progressive holocaust for anyone who isn't a stubborn Chud. ...,9,1,38,5327,,false
1711271425695515079,https://x.com/xenocosmography/status/1711271425695515079,2023-10-09 06:44:36,... Thermidorean regime after the Woke-Bioleninist Revolution will have roughly 100% white trans lesbian leadership and will look superficially indistinguishable from an English Eighteenth Century parliament.,2,2,35,3991,,false
1711272417111506984,https://x.com/xenocosmography/status/1711272417111506984,2023-10-09 06:48:32,"... Absolute power in the hands of oppressed minorities without anything dusky, female, or (cis) gay in sight.",1,0,18,1415,,false
1711273194542559281,https://x.com/xenocosmography/status/1711273194542559281,2023-10-09 06:51:38,... It's so brilliantly evil I feel a little bad about ratting it out.,2,0,21,1974,,false
1711276311489192269,https://x.com/xenocosmography/status/1711276311489192269,2023-10-09 07:04:01,"... The trans black road was neater, but that was blocked (somehow), so they had to route around it.",1,0,11,2197,,false
1711282216171671891,https://x.com/xenocosmography/status/1711282216171671891,2023-10-09 07:27:29,Extraordinary (in several ways simultaneously).,0,0,1,244,,false
1711286798675214373,https://x.com/xenocosmography/status/1711286798675214373,2023-10-09 07:45:41,Ultra-liberalism only works as an Anglo-Protestant religion.,1,0,2,183,,false
1711290797151457335,https://x.com/xenocosmography/status/1711290797151457335,2023-10-09 08:01:34,Simply the Invisible Hand.,0,0,2,106,,false
1711292433886261463,https://x.com/xenocosmography/status/1711292433886261463,2023-10-09 08:08:05,"Do Opensource Doomsday = 2023 (Synx). 
Now is the time.",4,2,31,2846,,true
1711296672423465224,https://x.com/xenocosmography/status/1711296672423465224,2023-10-09 08:24:55,"Despite the blizzard of religious accounts, I've yet to see a single post interpreting the latest bloody mayhem in the Holy Land in theological terms. Telling.",14,4,65,4538,,false
1711298111245836400,https://x.com/xenocosmography/status/1711298111245836400,2023-10-09 08:30:38,"... Post-Christendom is here, introducing great mysteries. (Abrahamic religion in the crypt, raggedly-disguised nihilism flitting amongst the spires.)",1,1,30,1644,,false
1711299532573773827,https://x.com/xenocosmography/status/1711299532573773827,2023-10-09 08:36:17,"... More or less overt tribal squabbling, promoted through secular moral argument, exhausts every dispute. What's fated is entirely missed.",0,1,24,1446,,false
1711300221505065387,https://x.com/xenocosmography/status/1711300221505065387,2023-10-09 08:39:01,This is just identifying sources of aggravation. Pure secular history.,1,0,0,74,,false
1711305701027663968,https://x.com/xenocosmography/status/1711305701027663968,2023-10-09 09:00:48,Someone at the controls with a serious over-sensitivity problem.,0,0,4,1713,,true
1711306286208626968,https://x.com/xenocosmography/status/1711306286208626968,2023-10-09 09:03:07,"Yes, this one should count. (The humor was distracting.)",0,0,1,99,,false
1711310335658078685,https://x.com/xenocosmography/status/1711310335658078685,2023-10-09 09:19:13,"Everyone agrees that X suddenly muting linked headlines is dumb and annoying, right?",3,0,37,1688,,false
1711312525965611244,https://x.com/xenocosmography/status/1711312525965611244,2023-10-09 09:27:55,"While almost universally distressing to human moral sensibilities, the only way to incur the wrath of Gnon is through weakness. When seemingly extravagant punishments are on display, start there.",3,5,55,7527,,false
1711313102497886540,https://x.com/xenocosmography/status/1711313102497886540,2023-10-09 09:30:12,Annoying accelerationism?,1,0,3,259,,false
1711333336806031557,https://x.com/xenocosmography/status/1711333336806031557,2023-10-09 10:50:37,You mean the United Nations? (Agree that it's wise to ration attention.),1,0,0,119,,false
1711333989116739844,https://x.com/xenocosmography/status/1711333989116739844,2023-10-09 10:53:12,Less miraculous (which fits David Hume's death).,0,0,1,120,,false
1711347829325910383,https://x.com/xenocosmography/status/1711347829325910383,2023-10-09 11:48:12,How much musing time do I get?,0,0,1,195,,false
1711367530575761700,https://x.com/xenocosmography/status/1711367530575761700,2023-10-09 13:06:29,"A rare ""literally shaking"" caught in the wild.",3,1,11,595,,false
1711367903319413157,https://x.com/xenocosmography/status/1711367903319413157,2023-10-09 13:07:58,"... ""Downright dysphoric"" deserves elevation to the same aethyr of advanced left-liberal sensitivity.",0,0,2,100,,false
1711413718431740094,https://x.com/xenocosmography/status/1711413718431740094,2023-10-09 16:10:01,"""Do stuff on behalf of the the Jews, and you can be unrestrainedly Gnonological.""
-- Troubling to some, understandably.",0,1,11,1887,,false
1711417329438073033,https://x.com/xenocosmography/status/1711417329438073033,2023-10-09 16:24:22,Gnon gave the weirdo right Richard Spencer and Jordan Peterson to prevent us thinking excited monkeys could save us.,1,3,35,2802,,false
