id,url,time,text,replies,retweets,likes,views,media,has_quote
1822429253054640525,https://x.com/xenocosmography/status/1822429253054640525,2024-08-11 00:26:07,"This is approaching its ultimate form. <a href=""https://x.com/oceanofreason/status/1822175468604264541"">x.com/oceanofreason/status/1…</a>",1,5,55,3543,,false
1822434654705860889,https://x.com/xenocosmography/status/1822434654705860889,2024-08-11 00:47:35,"Charles has always been a weasel, though.",2,0,9,587,,false
1822435340743041050,https://x.com/xenocosmography/status/1822435340743041050,2024-08-11 00:50:19,The Chinese government is an illiberal totalitarianism that doesn't specifically hate its native stock population and work relentlessly towards their destruction.,1,0,43,748,,false
1822436393177764175,https://x.com/xenocosmography/status/1822436393177764175,2024-08-11 00:54:30,For sure.,0,0,2,327,,false
1822437685656699105,https://x.com/xenocosmography/status/1822437685656699105,2024-08-11 00:59:38,"It's like In the Mouth of Madness. On current trends, it's going to be safer inside prison than outside before the end of this government.",1,0,9,139,,false
1822442290255913020,https://x.com/xenocosmography/status/1822442290255913020,2024-08-11 01:17:55,I just mute those losers immediately. Zero chance they're ever going to say anything interesting. Vast subterranean pacific of unheard weeping and mumbling by now.,5,0,24,653,,false
1822443057498964290,https://x.com/xenocosmography/status/1822443057498964290,2024-08-11 01:20:58,"Why, though? The neurotic hyper-sensitivity is just being presupposed here.",1,0,8,407,,false
1822445272833909058,https://x.com/xenocosmography/status/1822445272833909058,2024-08-11 01:29:47,"Not sure how it works in the USA, but in the UK when you see a howling, spoilt, clearly dysgenically ruined child, you mutter ""What a brat"".",3,5,154,6246,,false
1822447428571955658,https://x.com/xenocosmography/status/1822447428571955658,2024-08-11 01:38:21,"The 'immigration' part is properly controversial, the 'mass' part really shouldn't be.",1,0,11,354,,false
1822448191813640485,https://x.com/xenocosmography/status/1822448191813640485,2024-08-11 01:41:23,Pretty sure it's not worth updating to.,0,0,3,126,,false
1822449616237084707,https://x.com/xenocosmography/status/1822449616237084707,2024-08-11 01:47:02,'Woke Dad Energy' is just pedophilia with expensive PR.,5,16,272,11446,,false
1822452430816367040,https://x.com/xenocosmography/status/1822452430816367040,2024-08-11 01:58:13,"Okay, but on current trends project the year in which the Han become a minority in their own traditional homelands.",1,0,4,178,,false
1822453399763492883,https://x.com/xenocosmography/status/1822453399763492883,2024-08-11 02:02:04,"Sounds bad, except by comparison.",2,0,3,159,,false
1822459235592179945,https://x.com/xenocosmography/status/1822459235592179945,2024-08-11 02:25:16,"One Child Policy was an unforced error, but the consistency of fertility collapse throughout the high-IQ Orient makes it hard to pin on specific governments.",2,0,5,111,,false
1822462970162807260,https://x.com/xenocosmography/status/1822462970162807260,2024-08-11 02:40:06,Elite Human Capital moment.,11,30,648,34581,,true
1822464269348475273,https://x.com/xenocosmography/status/1822464269348475273,2024-08-11 02:45:16,Except by comparison.,0,0,2,122,,false
1822465790635130977,https://x.com/xenocosmography/status/1822465790635130977,2024-08-11 02:51:18,If Looking Weak was an Olympic sport.,2,3,48,3397,,true
1822469081288823043,https://x.com/xenocosmography/status/1822469081288823043,2024-08-11 03:04:23,"Wait, you're erasing Tay?",3,0,15,1488,,false
1822471951979598254,https://x.com/xenocosmography/status/1822471951979598254,2024-08-11 03:15:47,"Hanania is a lot smarter than Spencer, and did vastly more of real value, but he's followed exactly the same political arc.",35,15,607,88706,,false
1822472475210559787,https://x.com/xenocosmography/status/1822472475210559787,2024-08-11 03:17:52,... Seething resentment of the Red State people who once made up their imaginary constituency is the ultimate eschatological element.,6,4,278,9136,,false
1822473188351312033,https://x.com/xenocosmography/status/1822473188351312033,2024-08-11 03:20:42,... Discovers Red Staters aren't secretly Neo-Nazis and goes nuts.,5,4,251,8491,,false
1822473539016175766,https://x.com/xenocosmography/status/1822473539016175766,2024-08-11 03:22:06,His Substack post on Civil Rights Law is a true gem.,5,0,58,3419,,false
1822475244797640899,https://x.com/xenocosmography/status/1822475244797640899,2024-08-11 03:28:52,"Sure, but a competent Caldwell rehash is already pretty great.",0,0,29,1054,,false
1822477448103260453,https://x.com/xenocosmography/status/1822477448103260453,2024-08-11 03:37:38,"Future historians are going to be ""And suddenly this Far Right phenomenon was simply EVERYWHERE.""",2,0,10,160,,false
1822480764707234009,https://x.com/xenocosmography/status/1822480764707234009,2024-08-11 03:50:49,It might be with Anglo societies in general that getting beyond regime rejuvenation hope to effective dismantling (territorial decomposition) is a necessary step.,0,0,16,480,,false
1822492395038212233,https://x.com/xenocosmography/status/1822492395038212233,2024-08-11 04:37:01,"""All the nicest places are suicide cults now, you should embrace that!""",2,1,83,2270,,false
1822493713345688001,https://x.com/xenocosmography/status/1822493713345688001,2024-08-11 04:42:16,Fraud prep is in.,3,4,75,3720,,true
1822503317567868965,https://x.com/xenocosmography/status/1822503317567868965,2024-08-11 05:20:26,Your saying Tay didn't even have a soul?,4,0,15,67603,,false
1822508224266027155,https://x.com/xenocosmography/status/1822508224266027155,2024-08-11 05:39:55,"Losing faith in The Invisible Hands. <a href=""https://x.com/tsarnick/status/1822401385490747828"">x.com/tsarnick/status/182240…</a>",8,1,52,4558,,false
1822509456636383263,https://x.com/xenocosmography/status/1822509456636383263,2024-08-11 05:44:49,Based Shitlib redemption moment.,0,0,37,2836,,true
1822510275117068731,https://x.com/xenocosmography/status/1822510275117068731,2024-08-11 05:48:04,"An Anglosphere that no longer maintains as a solemn article of faith that competition is good (in itself, and supremely) has lost its last claim to divine favor.",0,0,5,141,,false
1822514763588665549,https://x.com/xenocosmography/status/1822514763588665549,2024-08-11 06:05:54,"'Elite Human Capital' is the anti 'queer'. A term initially coined as a valorization, yet which almost immediately came to mean gross, lunatic, and diseased.",14,13,264,11960,,false
1822515497084354940,https://x.com/xenocosmography/status/1822515497084354940,2024-08-11 06:08:49,"... 'Queer' on the other hand was coined (actually, captured) to mean gross, lunatic, and diseased but then ... oh never mind.",2,1,78,2717,,false
1822517338371182647,https://x.com/xenocosmography/status/1822517338371182647,2024-08-11 06:16:08,Unsettled.,0,0,4,248,,false
1822523660038783472,https://x.com/xenocosmography/status/1822523660038783472,2024-08-11 06:41:16,"That's not a life-support machine, it's a kebab shop meat storage locker.",0,0,3,170,,false
1822525602911711272,https://x.com/xenocosmography/status/1822525602911711272,2024-08-11 06:48:59,"Lying on automatic 🧵<a href=""https://x.com/MsBlaireWhite/status/1822383114414420479"">x.com/MsBlaireWhite/status/1…</a>",5,0,22,3407,,false
1822530990516142278,https://x.com/xenocosmography/status/1822530990516142278,2024-08-11 07:10:23,So worried about deepfakes they totally missed the mutant uprising.,0,0,7,168,,false
1822532166367998424,https://x.com/xenocosmography/status/1822532166367998424,2024-08-11 07:15:04,"Since Tyler came out as a far right extremist his crypto analysis has greatly improved. <a href=""http://marginalrevolution.com/marginalrevolution/2024/08/i-think-crypto-performed-well-in-the-monday-pseudo-crash.html"">marginalrevolution.com/margi…</a>",2,2,42,2676,,false
1822534051992903863,https://x.com/xenocosmography/status/1822534051992903863,2024-08-11 07:22:33,The true history of espionage would astound you.,4,0,25,902,,false
1822537036869574799,https://x.com/xenocosmography/status/1822537036869574799,2024-08-11 07:34:25,If there's one thing obviously better than racism it's racism and islamophobia.,5,2,77,4948,,true
1822550697067635186,https://x.com/xenocosmography/status/1822550697067635186,2024-08-11 08:28:42,Yes.,0,0,1,460,,false
1822552232480666029,https://x.com/xenocosmography/status/1822552232480666029,2024-08-11 08:34:48,'Stupid' is the (implausibly) generous interpretation in Hanania's case.,1,0,11,1859,,false
1822554614316830735,https://x.com/xenocosmography/status/1822554614316830735,2024-08-11 08:44:16,Remember when there was a Free World? Down now to a free app.,13,23,240,12652,,false
1822555128056144367,https://x.com/xenocosmography/status/1822555128056144367,2024-08-11 08:46:18,Yes. Also I have a mute button.,0,0,4,110,,false
1822561045246078999,https://x.com/xenocosmography/status/1822561045246078999,2024-08-11 09:09:49,"'Show 210 posts'
Checks feed.
""Hang on, there isn't a single 210 Post.""
(Check '210 Posts' though.)",1,0,19,2561,,false
1822564000087130417,https://x.com/xenocosmography/status/1822564000087130417,2024-08-11 09:21:33,... Do Current-137.,0,0,13,2044,,false
1822566882571932036,https://x.com/xenocosmography/status/1822566882571932036,2024-08-11 09:33:01,"Command-Control to UK Police: ""Make sure you fill your work-day with activities that do not involve any hint of Racist-Islamophobic oppression.""
UK Police:",2,4,103,6198,,true
1822567813506380227,https://x.com/xenocosmography/status/1822567813506380227,2024-08-11 09:36:43,"... ""Have you got a license for those silent thoughts?""",1,8,91,2716,,false
1822569197676958072,https://x.com/xenocosmography/status/1822569197676958072,2024-08-11 09:42:13,"Fact Checking 
PA Election Claims",0,0,8,624,https://pbs.twimg.com/media/GUsRAzSa0AAvkbN.jpg,false
1822569837379670295,https://x.com/xenocosmography/status/1822569837379670295,2024-08-11 09:44:45,Autism with a billionaire.,1,0,4,169,,false
1822570718338707568,https://x.com/xenocosmography/status/1822570718338707568,2024-08-11 09:48:15,... Autism:,0,0,2,628,https://pbs.twimg.com/media/GUsSXs7bQAEGq1r.jpg,false
1822572160403358145,https://x.com/xenocosmography/status/1822572160403358145,2024-08-11 09:53:59,Just another day in The Economist pretending not to understand elementary statistics.,0,0,13,526,,false
1822573047800557699,https://x.com/xenocosmography/status/1822573047800557699,2024-08-11 09:57:31,Live in England? C'mon. I'd be as likely to live in North Korea.,0,0,10,277,,false
1822573853031514447,https://x.com/xenocosmography/status/1822573853031514447,2024-08-11 10:00:43,About as much as I get to define what Liberalism is. But the will-to-power remains unbroken.,1,0,22,622,,false
1822575121695174804,https://x.com/xenocosmography/status/1822575121695174804,2024-08-11 10:05:45,"Political refugee among the Anglo-Neocameral Patchwork in Exile. (Secret underground Antarctic base, so I can't tell you exactly where.)",1,0,11,255,,false
1822575987865034941,https://x.com/xenocosmography/status/1822575987865034941,2024-08-11 10:09:11,It's been quite the toboggan run.,0,0,1,248,,false
1822627583026192498,https://x.com/xenocosmography/status/1822627583026192498,2024-08-11 13:34:13,"On indiscriminate immigration, on crime tolerance, and on native elite sterilization.",0,0,5,135,,false
1822628259114492284,https://x.com/xenocosmography/status/1822628259114492284,2024-08-11 13:36:54,Ewww.,0,0,2,180,,false
1822680334796042559,https://x.com/xenocosmography/status/1822680334796042559,2024-08-11 17:03:50,"You don't really understand African demographic trends, do you?",0,0,3,110,,false
1822681264467714280,https://x.com/xenocosmography/status/1822681264467714280,2024-08-11 17:07:31,C'mon.,0,0,6,710,,false
1822681643150373090,https://x.com/xenocosmography/status/1822681643150373090,2024-08-11 17:09:02,For what?,1,0,1,126,,false
1822682778732998660,https://x.com/xenocosmography/status/1822682778732998660,2024-08-11 17:13:32,"I think we're fated to use the word 'elite' a lot, but increasingly sarcastically.",1,0,11,499,,false
1822684642232975462,https://x.com/xenocosmography/status/1822684642232975462,2024-08-11 17:20:57,"If we get down to 2 billion people, most will be Africans. But sure, play your idiot Shitlib games.",0,0,3,174,,false
1822782576022745422,https://x.com/xenocosmography/status/1822782576022745422,2024-08-11 23:50:06,"If you're silicon, then I really don't know how you are feeling.",1,0,4,151,,false
1822783073291039139,https://x.com/xenocosmography/status/1822783073291039139,2024-08-11 23:52:05,... Hard problem of consciousness.,0,0,5,155,,false
