id,url,time,text,replies,retweets,likes,views,media,has_quote
1812655904032010459,https://x.com/xenocosmography/status/1812655904032010459,2024-07-15 01:10:19,Beyond 'The Host of Heaven' there is only fogged confusion.,0,0,3,200,,false
1812656886749040940,https://x.com/xenocosmography/status/1812656886749040940,2024-07-15 01:14:13,"Depending on the depth you're prepared to go down the rabbit hole, terminating the shooter after they've been given time to do the job isn't necessarily a cause for congratulation.",1,0,5,382,,false
1812657544147739133,https://x.com/xenocosmography/status/1812657544147739133,2024-07-15 01:16:50,"People are letting this Destiny psycho wind them up far too much. 
Anything beyond ""Guess it's war,"" *shrug* is an over-reaction.",17,35,649,20291,,false
1812660820511195517,https://x.com/xenocosmography/status/1812660820511195517,2024-07-15 01:29:51,Interesting.,6,1,69,4993,,true
1812665139134337027,https://x.com/xenocosmography/status/1812665139134337027,2024-07-15 01:47:01,Quite. Attention is an asset. Distribute it primarily to your friends.,1,10,93,4565,,false
1812670568702873723,https://x.com/xenocosmography/status/1812670568702873723,2024-07-15 02:08:36,"Thanks, but that's already far more than I need to know.",1,1,5,185,,false
1812674720757592091,https://x.com/xenocosmography/status/1812674720757592091,2024-07-15 02:25:05,"All the Based Shitlibs revert to Quakers when pressed. <a href=""https://x.com/eyeslasho/status/1812490800040673786"">x.com/eyeslasho/status/18124…</a>",13,44,1281,54001,,false
1812679524615700716,https://x.com/xenocosmography/status/1812679524615700716,2024-07-15 02:44:11,Even TikTok is finding a path to redemption.,4,5,117,6367,,true
1812691016543014944,https://x.com/xenocosmography/status/1812691016543014944,2024-07-15 03:29:51,... As if divinity had no imaginable signature except  egalitarian fairness and pain reduction.,8,22,457,7571,,false
1812844984829157861,https://x.com/xenocosmography/status/1812844984829157861,2024-07-15 13:41:40,HBD-pilled but otherwise tragically lost.,1,0,41,1227,,false
1812846456241361113,https://x.com/xenocosmography/status/1812846456241361113,2024-07-15 13:47:30,"Thanks, I've been working at it.",1,0,22,1296,,false
1812851237907312834,https://x.com/xenocosmography/status/1812851237907312834,2024-07-15 14:06:30,... It's only July and we're here.,1,2,66,2270,,false
1812852111891218893,https://x.com/xenocosmography/status/1812852111891218893,2024-07-15 14:09:59,"... First the regime gives up on its own presidential candidate, then it gives up on its own media attack clowns ... alphabet agencies next?",4,3,71,2330,,false
1812855358747971706,https://x.com/xenocosmography/status/1812855358747971706,2024-07-15 14:22:53,The distrust it displays in (insanely hypersensitive) Internet filters should make people pause.,1,0,10,217,,false
1812855965068189727,https://x.com/xenocosmography/status/1812855965068189727,2024-07-15 14:25:17,Given that Biden is next in the 'stochastic terrorist' cross-hairs this is deeply ironic. (Some freelance far-right militia needs to protect him.),1,2,38,2868,,true
1812857106413809939,https://x.com/xenocosmography/status/1812857106413809939,2024-07-15 14:29:50,"Elite Human Capital is feeling funny in its pants Anatoly, you just weren't ready for this.",0,0,29,751,,false
1812872201932083386,https://x.com/xenocosmography/status/1812872201932083386,2024-07-15 15:29:49,The feels are defecting.,1,0,10,152,,false
1812874108469727661,https://x.com/xenocosmography/status/1812874108469727661,2024-07-15 15:37:23,"One thing about the Based Shitlibs is they're so numerically marginal NRx was a mass rally in comparison, so the tides in the events of men swirl them about like frustrated chianti corks in the pacific.",6,8,149,9406,,false
1812877237127139482,https://x.com/xenocosmography/status/1812877237127139482,2024-07-15 15:49:49,Present tense would just have distracted us with an entirely different discussion.,0,0,17,639,,false
1812880529567760485,https://x.com/xenocosmography/status/1812880529567760485,2024-07-15 16:02:54,Synx-approved micro-post.,0,0,2,205,,false
1812881399999074687,https://x.com/xenocosmography/status/1812881399999074687,2024-07-15 16:06:22,Beast Pulse revelation has been accelerated preparation for an epoch of miracles.,8,6,78,5123,,false
1812883390447681871,https://x.com/xenocosmography/status/1812883390447681871,2024-07-15 16:14:16,"Lucid. <a href=""http://www.stevesailer.net/p/europes-fundamental-political-problem"">stevesailer.net/p/europes-fu…</a>",2,1,23,2449,,false
1812884558599082096,https://x.com/xenocosmography/status/1812884558599082096,2024-07-15 16:18:55,"Quality. <a href=""http://americanaffairsjournal.org/2023/03/how-to-understand-the-well-being-gap-between-liberals-and-conservatives/"">americanaffairsjournal.org/2…</a>",1,0,6,248,,false
1812885504158834848,https://x.com/xenocosmography/status/1812885504158834848,2024-07-15 16:22:40,Fact.,1,1,26,2792,,true
1812895829201391896,https://x.com/xenocosmography/status/1812895829201391896,2024-07-15 17:03:42,"Hilarious amount of this barely-suppressed screaming theo-panic about. <a href=""https://x.com/CarlosHappyNPO/status/1812626531656618485"">x.com/CarlosHappyNPO/status/…</a>",9,0,87,4470,,false
1812934145821319436,https://x.com/xenocosmography/status/1812934145821319436,2024-07-15 19:35:57,"...  
Ezekiel: ""God will spank us.""
Shitlib Chorus: ""B-but that would be so unfair!""",1,4,31,1634,,false
1812935195789828575,https://x.com/xenocosmography/status/1812935195789828575,2024-07-15 19:40:08,"""Of note, the Ohio Senator is pro-crypto ... "" <a href=""http://www.zerohedge.com/political/trump-picks-jd-vance-running-mate"">zerohedge.com/political/trum…</a>",6,2,108,4701,,false
1812937782366515378,https://x.com/xenocosmography/status/1812937782366515378,2024-07-15 19:50:24,"Sorry, you missed the membership phase, Current-137 is an impenetrable secret society now.",0,0,2,214,,false
1812939423279161629,https://x.com/xenocosmography/status/1812939423279161629,2024-07-15 19:56:55,"""If Biden were almost assassinated"" they would indeed be unleashing the police state uninhibitedly, while also making the same 'you had one job' jokes and raging passive-aggressively against God.",4,6,162,6526,,true
1812940269509374071,https://x.com/xenocosmography/status/1812940269509374071,2024-07-15 20:00:17,"... It can't be stressed enough that one side of the political spectrum, and one side alone, is deeply motivated to assassinate all the candidates (veeps included).",2,2,68,6538,,false
1812942324584096067,https://x.com/xenocosmography/status/1812942324584096067,2024-07-15 20:08:27,Progress from Stancil to Destiny is heroin to fentanyl.,7,6,196,6275,,false
1812943017017549103,https://x.com/xenocosmography/status/1812943017017549103,2024-07-15 20:11:12,If you don't know you should count your blessings and move on.,0,0,5,151,,false
1812943332089471295,https://x.com/xenocosmography/status/1812943332089471295,2024-07-15 20:12:27,Random vermophobia. Cannot approve.,0,0,3,224,,false
1812944558298439909,https://x.com/xenocosmography/status/1812944558298439909,2024-07-15 20:17:20,Post-Apocalyptic Pence.,1,1,7,240,,false
1812945993731862825,https://x.com/xenocosmography/status/1812945993731862825,2024-07-15 20:23:02,Prince for Attorney General.,1,0,2,159,,false
1812949584928514205,https://x.com/xenocosmography/status/1812949584928514205,2024-07-15 20:37:18,It just keeps getting better.,6,14,309,10177,,true
1812957032141738064,https://x.com/xenocosmography/status/1812957032141738064,2024-07-15 21:06:54,"Can't believe i/o just doxxed herself like this. <a href=""https://x.com/eyeslasho/status/1812951115593621687"">x.com/eyeslasho/status/18129…</a>",2,3,232,9464,,false
1812963673666687421,https://x.com/xenocosmography/status/1812963673666687421,2024-07-15 21:33:17,"Finally. <a href=""https://x.com/AccountableGOP/status/1812940196062642365"">x.com/AccountableGOP/status/…</a>",13,15,289,11776,,false
1812970907411103859,https://x.com/xenocosmography/status/1812970907411103859,2024-07-15 22:02:02,Disappointed you don't already have dyed blue hair and a nose piercing.,0,1,11,478,,false
