id,url,time,text,replies,retweets,likes,views,media,has_quote
1851074208031469609,https://x.com/xenocosmography/status/1851074208031469609,2024-10-29 01:30:57,You really should.,1,0,2,311,,false
1851074760782069979,https://x.com/xenocosmography/status/1851074760782069979,2024-10-29 01:33:08,Rightists failed to secure anything.  Without divine intervention / Elon Musk they'd be locked in a padded cell muttering sadly to themselves.,1,0,7,161,,false
1851078809057157614,https://x.com/xenocosmography/status/1851078809057157614,2024-10-29 01:49:14,Patchwork Neocam.,1,0,15,4626,,false
1851097120738328785,https://x.com/xenocosmography/status/1851097120738328785,2024-10-29 03:01:59,"Interesting discussion (of great current relevance), but Yarvin's complete lack of faith in The Invisible Hands always lends his analysis a very non-English, Jacobin vibe. <a href=""http://graymirror.substack.com/p/on-money-and-power"">graymirror.substack.com/p/on…</a>",5,3,59,3753,,false
1851099183861899683,https://x.com/xenocosmography/status/1851099183861899683,2024-10-29 03:10:11,"... It isn't clever coup making, but rather rationalistic political scheming humiliated by Solemn Providence that's the full story, at least in the English translation (from the original Italian).",1,0,34,1201,,false
1851102357876293982,https://x.com/xenocosmography/status/1851102357876293982,2024-10-29 03:22:48,"... Historical redemption of the English-speaking peoples will require a religious renaissance on the scale of the Reformation (at least), and that is most certainly coming. What Gutenberg is to Protestantism, the AI-Internet is to ...",3,1,46,2395,,false
1851102870797713567,https://x.com/xenocosmography/status/1851102870797713567,2024-10-29 03:24:50,"... Government under Gnon, as the founders understood.",0,5,41,3264,,false
1851104676751765654,https://x.com/xenocosmography/status/1851104676751765654,2024-10-29 03:32:01,"Faithlessness, surely?",1,0,2,124,,false
1851110765983576229,https://x.com/xenocosmography/status/1851110765983576229,2024-10-29 03:56:13,"Cultural rededication to the sacredness of the principle of spontaneous order, aka divine providence (The Invisible Hands). ""Thy will be done."" 
The revolutionary aspect, I have to assume based upon historical analogy, will concern ecclesiastical organization. ...",1,0,7,280,,false
1851112585497886943,https://x.com/xenocosmography/status/1851112585497886943,2024-10-29 04:03:27,"... The churches have failed, as the Church did. Moldbug's 'Cathedral' is this failure, as a positive, emergent institution. To obsolesce the Cathedral requires new vehicles of faith, effective cults of holy liberty.",1,1,8,305,,false
1851124608730349739,https://x.com/xenocosmography/status/1851124608730349739,2024-10-29 04:51:13,Solid allies against the woke heresy rampaging through all religious and educational institutions.,0,0,5,164,,false
1851127149459358018,https://x.com/xenocosmography/status/1851127149459358018,2024-10-29 05:01:19,Nicknamed 'Morning Star'.,20,15,286,21512,,true
1851129209059733541,https://x.com/xenocosmography/status/1851129209059733541,2024-10-29 05:09:30,Vance has no idea what's coming for him.,16,22,602,22901,,true
1851158764554240250,https://x.com/xenocosmography/status/1851158764554240250,2024-10-29 07:06:56,"נחש / מָשִׁיחַ קַבָּלָה
moment",2,0,9,1037,,false
1851159392374427956,https://x.com/xenocosmography/status/1851159392374427956,2024-10-29 07:09:26,"Woah. <a href=""https://x.com/technarcissism/status/1850650218129412209"">x.com/technarcissism/status/…</a>",3,2,44,5101,,false
1851163397083242721,https://x.com/xenocosmography/status/1851163397083242721,2024-10-29 07:25:21,"Good for them. Bauhaus is communist architecture. <a href=""http://www.reuters.com/world/europe/germanys-far-right-stirs-up-culture-war-over-bauhaus-legacy-2024-10-27/"">reuters.com/world/europe/ger…</a>",3,2,39,2424,,false
1851165394150809881,https://x.com/xenocosmography/status/1851165394150809881,2024-10-29 07:33:17,Technical difficulties.,1,0,4,197,,true
1851167086732853456,https://x.com/xenocosmography/status/1851167086732853456,2024-10-29 07:40:01,Six amazing things are about to happen.,2,0,1,219,,false
1851167702796427574,https://x.com/xenocosmography/status/1851167702796427574,2024-10-29 07:42:28,That would be quite a list.,0,0,2,93,,false
1851224286574649414,https://x.com/xenocosmography/status/1851224286574649414,2024-10-29 11:27:18,"None have been successful yet, so ...",0,0,3,99,,false
1851225599131730134,https://x.com/xenocosmography/status/1851225599131730134,2024-10-29 11:32:31,"""... Harris had in fact implemented a statewide policy of taxpayer funding for prisoners’ sex changes ..."" ... <a href=""http://www.tabletmag.com/sections/news/articles/democrats-insanity-defense"">tabletmag.com/sections/news/…</a>",8,11,165,8615,,false
1851225852778037270,https://x.com/xenocosmography/status/1851225852778037270,2024-10-29 11:33:32,"... ""... born out of a settlement in which she agreed to pay for the transition of a man convicted of kidnapping a father of three and then murdering him as he begged for his life. """,1,3,71,3297,,false
1851226812388659296,https://x.com/xenocosmography/status/1851226812388659296,2024-10-29 11:37:20,"... ""'When you outline the Democratic agenda, you have to water it down, because in both polling and focus groups, people just don’t believe it,' [A GOP staffer] said. 
It's so insane that describing it realistically sounds like wild hostile propaganda.",7,18,144,9674,,false
1851235730825105431,https://x.com/xenocosmography/status/1851235730825105431,2024-10-29 12:12:47,"The Invisible Hands are Right Liberal, the Zeitgeist is Left Liberal.",0,1,7,201,,false
1851236026251137470,https://x.com/xenocosmography/status/1851236026251137470,2024-10-29 12:13:57,Praying no one ever knows.,6,5,14,689,,false
1851257777269981403,https://x.com/xenocosmography/status/1851257777269981403,2024-10-29 13:40:23,"If you won't accept Isaiah 14:12 (""O Lucifer, son of the morning""), Job 38:7 (""When the morning stars sung together""), or 2 Peter 1:19 (""the day star""), there's still Revelation 2:28, and Revelation 22:16.",2,1,6,1020,,false
1851307603303023021,https://x.com/xenocosmography/status/1851307603303023021,2024-10-29 16:58:22,Forced.,1,0,2,160,,false
1851308043872714862,https://x.com/xenocosmography/status/1851308043872714862,2024-10-29 17:00:07,"Hang on, your Bible is just the new Testament?",11,4,187,14233,,false
1851309343754596564,https://x.com/xenocosmography/status/1851309343754596564,2024-10-29 17:05:17,"Okay, but seems non-providential.",1,0,10,976,,false
1851310433057300538,https://x.com/xenocosmography/status/1851310433057300538,2024-10-29 17:09:37,"... 66 books in the KJV, so it's obvious we need all of them.",1,1,57,3205,,false
1851310778764443872,https://x.com/xenocosmography/status/1851310778764443872,2024-10-29 17:11:00,Eww,0,0,14,823,,false
