id,url,time,text,replies,retweets,likes,views,media,has_quote
1988848414746943900,https://x.com/xenocosmography/status/1988848414746943900,2025-11-13 05:56:27,"As a Pisces, I've felt the current Aeon dying within me my whole life. Does it work the opposite way around with you? (Genuine question.)",4,1,6,399,,false
1988892240542859555,https://x.com/xenocosmography/status/1988892240542859555,2025-11-13 08:50:36,Makes me realize what I like about the Shanghai metro.,7,1,180,4251,,false
1988897518126563427,https://x.com/xenocosmography/status/1988897518126563427,2025-11-13 09:11:34,"You're over-interpreting this. It's for highly-qualified technical experts, who have been very welcome since the 1990s. Nothing close to mass immigration.",0,2,84,2246,,false
1989026757773783399,https://x.com/xenocosmography/status/1989026757773783399,2025-11-13 17:45:08,"So 80% of my TL is people explaining that Adolf Hitler was an intersectionally oppressed polyvictim of neurodivergent minorities. 
Anything but Trump is now here.",10,3,194,10411,,false
1989027663089197161,https://x.com/xenocosmography/status/1989027663089197161,2025-11-13 17:48:43,"... ""Trump is more Hitler than Hitler, because Hitler was struggling against oppressive structure of neuro-normativity, bigot!""",10,3,137,8015,,false
1989028464184492230,https://x.com/xenocosmography/status/1989028464184492230,2025-11-13 17:51:54,"Half my conscious life is consumed by you, Brendan. How would becoming your mutual (again) affect that in an imaginably desirable way?",1,0,8,511,,false
1989029308053221420,https://x.com/xenocosmography/status/1989029308053221420,2025-11-13 17:55:16,Hitler being autistic isn't enough to make me like the guy. (Saying this while it's still allowable.),26,15,384,33688,,false
