id,url,time,text,replies,retweets,likes,views,media,has_quote
1948238487351652827,https://x.com/xenocosmography/status/1948238487351652827,2025-07-24 04:27:06,"Okay as a token, but awesome as the start of an avalanche.",10,6,225,11414,,true
1948423531521282177,https://x.com/xenocosmography/status/1948423531521282177,2025-07-24 16:42:24,The Dissident Anglo-Protestant diaspora is only very crudely summarized as 'American.',2,0,5,1557,,false
1948443477248823584,https://x.com/xenocosmography/status/1948443477248823584,2025-07-24 18:01:39,Ankle-biting nobodies of the day are undergoing precipitous quality decline.,2,0,5,730,,false
1948443976492540344,https://x.com/xenocosmography/status/1948443976492540344,2025-07-24 18:03:38,"First Ozzy Osborne, then Hulk Hogan -- everywhere darkness and wailings of grief.",17,39,762,37828,,false
1948444390403231779,https://x.com/xenocosmography/status/1948444390403231779,2025-07-24 18:05:17,... History will recall this moment as a great culling of the gods.,8,4,183,6224,,false
